,sample_code,station_no,site,seaweed,date,day,month,year,parsed_date,species_id,measurement_value,measurement_type,measurement_origin,y_axis,station,sample_order
31,Pabay_10_4_22_1,1,Pabay,Alaria,10/04/2022,10,4,2022,10/04/2022,mytilus_ala_p_cm,0,blade,Blade Abundance – Alaria (ind/cm²),Mytilus Blade Ab - Ala,1,2022-04-10_1
32,Pabay_10_4_22_1,1,Pabay,Alaria,10/04/2022,10,4,2022,10/04/2022,ostrea_ala_p_cm,0,blade,Blade Abundance – Alaria (ind/cm²),Ostrea Blade Ab - Ala,1,2022-04-10_1
33,Pabay_10_4_22_1,1,Pabay,Alaria,10/04/2022,10,4,2022,10/04/2022,pecten_ala_p_cm,0,blade,Blade Abundance – Alaria (ind/cm²),Pecten Blade Ab - Ala,1,2022-04-10_1
34,Pabay_10_4_22_1,1,Pabay,Alaria,10/04/2022,10,4,2022,10/04/2022,scallop_brown_ala_p_cm,0,blade,Blade Abundance – Alaria (ind/cm²),Scallop Blade Ab - Ala,1,2022-04-10_1
42,Pabay_10_4_22_2,2,Pabay,Alaria,10/04/2022,10,4,2022,10/04/2022,ostrea_ala_p_cm,0,blade,Blade Abundance – Alaria (ind/cm²),Ostrea Blade Ab - Ala,2,2022-04-10_2
43,Pabay_10_4_22_2,2,Pabay,Alaria,10/04/2022,10,4,2022,10/04/2022,pecten_ala_p_cm,0,blade,Blade Abundance – Alaria (ind/cm²),Pecten Blade Ab - Ala,2,2022-04-10_2
44,Pabay_10_4_22_2,2,Pabay,Alaria,10/04/2022,10,4,2022,10/04/2022,scallop_brown_ala_p_cm,0,blade,Blade Abundance – Alaria (ind/cm²),Scallop Blade Ab - Ala,2,2022-04-10_2
45,Pabay_10_4_22_2,2,Pabay,Alaria,10/04/2022,10,4,2022,10/04/2022,bivalve_ala_p_cm,0,blade,Blade Abundance – Alaria (ind/cm²),Bivalvia Blade Ab - Ala,2,2022-04-10_2
51,Pabay_10_4_22_3,3,Pabay,Alaria,10/04/2022,10,4,2022,10/04/2022,mytilus_ala_p_cm,0,blade,Blade Abundance – Alaria (ind/cm²),Mytilus Blade Ab - Ala,3,2022-04-10_3
52,Pabay_10_4_22_3,3,Pabay,Alaria,10/04/2022,10,4,2022,10/04/2022,ostrea_ala_p_cm,0,blade,Blade Abundance – Alaria (ind/cm²),Ostrea Blade Ab - Ala,3,2022-04-10_3
54,Pabay_10_4_22_3,3,Pabay,Alaria,10/04/2022,10,4,2022,10/04/2022,scallop_brown_ala_p_cm,0,blade,Blade Abundance – Alaria (ind/cm²),Scallop Blade Ab - Ala,3,2022-04-10_3
241,Pabay_21_3_22_1,1,Pabay,Alaria,21/03/2022,21,3,2022,21/03/2022,mytilus_ala_p_cm,0,blade,Blade Abundance – Alaria (ind/cm²),Mytilus Blade Ab - Ala,1,2022-03-21_1
242,Pabay_21_3_22_1,1,Pabay,Alaria,21/03/2022,21,3,2022,21/03/2022,ostrea_ala_p_cm,0,blade,Blade Abundance – Alaria (ind/cm²),Ostrea Blade Ab - Ala,1,2022-03-21_1
243,Pabay_21_3_22_1,1,Pabay,Alaria,21/03/2022,21,3,2022,21/03/2022,pecten_ala_p_cm,0,blade,Blade Abundance – Alaria (ind/cm²),Pecten Blade Ab - Ala,1,2022-03-21_1
244,Pabay_21_3_22_1,1,Pabay,Alaria,21/03/2022,21,3,2022,21/03/2022,scallop_brown_ala_p_cm,0,blade,Blade Abundance – Alaria (ind/cm²),Scallop Blade Ab - Ala,1,2022-03-21_1
245,Pabay_21_3_22_1,1,Pabay,Alaria,21/03/2022,21,3,2022,21/03/2022,bivalve_ala_p_cm,0,blade,Blade Abundance – Alaria (ind/cm²),Bivalvia Blade Ab - Ala,1,2022-03-21_1
251,Pabay_21_3_22_2,2,Pabay,Alaria,21/03/2022,21,3,2022,21/03/2022,mytilus_ala_p_cm,0,blade,Blade Abundance – Alaria (ind/cm²),Mytilus Blade Ab - Ala,2,2022-03-21_2
252,Pabay_21_3_22_2,2,Pabay,Alaria,21/03/2022,21,3,2022,21/03/2022,ostrea_ala_p_cm,0,blade,Blade Abundance – Alaria (ind/cm²),Ostrea Blade Ab - Ala,2,2022-03-21_2
253,Pabay_21_3_22_2,2,Pabay,Alaria,21/03/2022,21,3,2022,21/03/2022,pecten_ala_p_cm,0,blade,Blade Abundance – Alaria (ind/cm²),Pecten Blade Ab - Ala,2,2022-03-21_2
254,Pabay_21_3_22_2,2,Pabay,Alaria,21/03/2022,21,3,2022,21/03/2022,scallop_brown_ala_p_cm,0,blade,Blade Abundance – Alaria (ind/cm²),Scallop Blade Ab - Ala,2,2022-03-21_2
255,Pabay_21_3_22_2,2,Pabay,Alaria,21/03/2022,21,3,2022,21/03/2022,bivalve_ala_p_cm,0,blade,Blade Abundance – Alaria (ind/cm²),Bivalvia Blade Ab - Ala,2,2022-03-21_2
261,Pabay_21_3_22_3,3,Pabay,Alaria,21/03/2022,21,3,2022,21/03/2022,mytilus_ala_p_cm,0,blade,Blade Abundance – Alaria (ind/cm²),Mytilus Blade Ab - Ala,3,2022-03-21_3
262,Pabay_21_3_22_3,3,Pabay,Alaria,21/03/2022,21,3,2022,21/03/2022,ostrea_ala_p_cm,0,blade,Blade Abundance – Alaria (ind/cm²),Ostrea Blade Ab - Ala,3,2022-03-21_3
263,Pabay_21_3_22_3,3,Pabay,Alaria,21/03/2022,21,3,2022,21/03/2022,pecten_ala_p_cm,0,blade,Blade Abundance – Alaria (ind/cm²),Pecten Blade Ab - Ala,3,2022-03-21_3
264,Pabay_21_3_22_3,3,Pabay,Alaria,21/03/2022,21,3,2022,21/03/2022,scallop_brown_ala_p_cm,0,blade,Blade Abundance – Alaria (ind/cm²),Scallop Blade Ab - Ala,3,2022-03-21_3
265,Pabay_21_3_22_3,3,Pabay,Alaria,21/03/2022,21,3,2022,21/03/2022,bivalve_ala_p_cm,0,blade,Blade Abundance – Alaria (ind/cm²),Bivalvia Blade Ab - Ala,3,2022-03-21_3
271,Pabay_22_5_22_1,1,Pabay,Alaria,22/05/2022,22,5,2022,22/05/2022,mytilus_ala_p_cm,0,blade,Blade Abundance – Alaria (ind/cm²),Mytilus Blade Ab - Ala,1,2022-05-22_1
272,Pabay_22_5_22_1,1,Pabay,Alaria,22/05/2022,22,5,2022,22/05/2022,ostrea_ala_p_cm,0,blade,Blade Abundance – Alaria (ind/cm²),Ostrea Blade Ab - Ala,1,2022-05-22_1
273,Pabay_22_5_22_1,1,Pabay,Alaria,22/05/2022,22,5,2022,22/05/2022,pecten_ala_p_cm,0,blade,Blade Abundance – Alaria (ind/cm²),Pecten Blade Ab - Ala,1,2022-05-22_1
274,Pabay_22_5_22_1,1,Pabay,Alaria,22/05/2022,22,5,2022,22/05/2022,scallop_brown_ala_p_cm,0,blade,Blade Abundance – Alaria (ind/cm²),Scallop Blade Ab - Ala,1,2022-05-22_1
275,Pabay_22_5_22_1,1,Pabay,Alaria,22/05/2022,22,5,2022,22/05/2022,bivalve_ala_p_cm,0,blade,Blade Abundance – Alaria (ind/cm²),Bivalvia Blade Ab - Ala,1,2022-05-22_1
281,Pabay_22_5_22_2,2,Pabay,Alaria,22/05/2022,22,5,2022,22/05/2022,mytilus_ala_p_cm,0,blade,Blade Abundance – Alaria (ind/cm²),Mytilus Blade Ab - Ala,2,2022-05-22_2
283,Pabay_22_5_22_2,2,Pabay,Alaria,22/05/2022,22,5,2022,22/05/2022,pecten_ala_p_cm,0,blade,Blade Abundance – Alaria (ind/cm²),Pecten Blade Ab - Ala,2,2022-05-22_2
284,Pabay_22_5_22_2,2,Pabay,Alaria,22/05/2022,22,5,2022,22/05/2022,scallop_brown_ala_p_cm,0,blade,Blade Abundance – Alaria (ind/cm²),Scallop Blade Ab - Ala,2,2022-05-22_2
291,Pabay_22_5_22_3,3,Pabay,Alaria,22/05/2022,22,5,2022,22/05/2022,mytilus_ala_p_cm,0,blade,Blade Abundance – Alaria (ind/cm²),Mytilus Blade Ab - Ala,3,2022-05-22_3
293,Pabay_22_5_22_3,3,Pabay,Alaria,22/05/2022,22,5,2022,22/05/2022,pecten_ala_p_cm,0,blade,Blade Abundance – Alaria (ind/cm²),Pecten Blade Ab - Ala,3,2022-05-22_3
294,Pabay_22_5_22_3,3,Pabay,Alaria,22/05/2022,22,5,2022,22/05/2022,scallop_brown_ala_p_cm,0,blade,Blade Abundance – Alaria (ind/cm²),Scallop Blade Ab - Ala,3,2022-05-22_3
301,Pabay_25_2_22_1,1,Pabay,Alaria,25/02/2022,25,2,2022,25/02/2022,mytilus_ala_p_cm,0,blade,Blade Abundance – Alaria (ind/cm²),Mytilus Blade Ab - Ala,1,2022-02-25_1
302,Pabay_25_2_22_1,1,Pabay,Alaria,25/02/2022,25,2,2022,25/02/2022,ostrea_ala_p_cm,0,blade,Blade Abundance – Alaria (ind/cm²),Ostrea Blade Ab - Ala,1,2022-02-25_1
303,Pabay_25_2_22_1,1,Pabay,Alaria,25/02/2022,25,2,2022,25/02/2022,pecten_ala_p_cm,0,blade,Blade Abundance – Alaria (ind/cm²),Pecten Blade Ab - Ala,1,2022-02-25_1
304,Pabay_25_2_22_1,1,Pabay,Alaria,25/02/2022,25,2,2022,25/02/2022,scallop_brown_ala_p_cm,0,blade,Blade Abundance – Alaria (ind/cm²),Scallop Blade Ab - Ala,1,2022-02-25_1
305,Pabay_25_2_22_1,1,Pabay,Alaria,25/02/2022,25,2,2022,25/02/2022,bivalve_ala_p_cm,0,blade,Blade Abundance – Alaria (ind/cm²),Bivalvia Blade Ab - Ala,1,2022-02-25_1
311,Pabay_25_2_22_2,2,Pabay,Alaria,25/02/2022,25,2,2022,25/02/2022,mytilus_ala_p_cm,0,blade,Blade Abundance – Alaria (ind/cm²),Mytilus Blade Ab - Ala,2,2022-02-25_2
312,Pabay_25_2_22_2,2,Pabay,Alaria,25/02/2022,25,2,2022,25/02/2022,ostrea_ala_p_cm,0,blade,Blade Abundance – Alaria (ind/cm²),Ostrea Blade Ab - Ala,2,2022-02-25_2
313,Pabay_25_2_22_2,2,Pabay,Alaria,25/02/2022,25,2,2022,25/02/2022,pecten_ala_p_cm,0,blade,Blade Abundance – Alaria (ind/cm²),Pecten Blade Ab - Ala,2,2022-02-25_2
314,Pabay_25_2_22_2,2,Pabay,Alaria,25/02/2022,25,2,2022,25/02/2022,scallop_brown_ala_p_cm,0,blade,Blade Abundance – Alaria (ind/cm²),Scallop Blade Ab - Ala,2,2022-02-25_2
315,Pabay_25_2_22_2,2,Pabay,Alaria,25/02/2022,25,2,2022,25/02/2022,bivalve_ala_p_cm,0,blade,Blade Abundance – Alaria (ind/cm²),Bivalvia Blade Ab - Ala,2,2022-02-25_2
321,Pabay_25_2_22_3,3,Pabay,Alaria,25/02/2022,25,2,2022,25/02/2022,mytilus_ala_p_cm,0,blade,Blade Abundance – Alaria (ind/cm²),Mytilus Blade Ab - Ala,3,2022-02-25_3
322,Pabay_25_2_22_3,3,Pabay,Alaria,25/02/2022,25,2,2022,25/02/2022,ostrea_ala_p_cm,0,blade,Blade Abundance – Alaria (ind/cm²),Ostrea Blade Ab - Ala,3,2022-02-25_3
323,Pabay_25_2_22_3,3,Pabay,Alaria,25/02/2022,25,2,2022,25/02/2022,pecten_ala_p_cm,0,blade,Blade Abundance – Alaria (ind/cm²),Pecten Blade Ab - Ala,3,2022-02-25_3
324,Pabay_25_2_22_3,3,Pabay,Alaria,25/02/2022,25,2,2022,25/02/2022,scallop_brown_ala_p_cm,0,blade,Blade Abundance – Alaria (ind/cm²),Scallop Blade Ab - Ala,3,2022-02-25_3
325,Pabay_25_2_22_3,3,Pabay,Alaria,25/02/2022,25,2,2022,25/02/2022,bivalve_ala_p_cm,0,blade,Blade Abundance – Alaria (ind/cm²),Bivalvia Blade Ab - Ala,3,2022-02-25_3
361,Pabay_30_1_22_1,1,Pabay,Saccharina,30/01/2022,30,1,2022,30/01/2022,mytilus_ala_p_cm,0,blade,Blade Abundance – Alaria (ind/cm²),Mytilus Blade Ab - Ala,1,2022-01-30_1
362,Pabay_30_1_22_1,1,Pabay,Saccharina,30/01/2022,30,1,2022,30/01/2022,ostrea_ala_p_cm,0,blade,Blade Abundance – Alaria (ind/cm²),Ostrea Blade Ab - Ala,1,2022-01-30_1
363,Pabay_30_1_22_1,1,Pabay,Saccharina,30/01/2022,30,1,2022,30/01/2022,pecten_ala_p_cm,0,blade,Blade Abundance – Alaria (ind/cm²),Pecten Blade Ab - Ala,1,2022-01-30_1
364,Pabay_30_1_22_1,1,Pabay,Saccharina,30/01/2022,30,1,2022,30/01/2022,scallop_brown_ala_p_cm,0,blade,Blade Abundance – Alaria (ind/cm²),Scallop Blade Ab - Ala,1,2022-01-30_1
365,Pabay_30_1_22_1,1,Pabay,Saccharina,30/01/2022,30,1,2022,30/01/2022,bivalve_ala_p_cm,0,blade,Blade Abundance – Alaria (ind/cm²),Bivalvia Blade Ab - Ala,1,2022-01-30_1
371,Pabay_30_1_22_2,2,Pabay,Saccharina,30/01/2022,30,1,2022,30/01/2022,mytilus_ala_p_cm,0,blade,Blade Abundance – Alaria (ind/cm²),Mytilus Blade Ab - Ala,2,2022-01-30_2
372,Pabay_30_1_22_2,2,Pabay,Saccharina,30/01/2022,30,1,2022,30/01/2022,ostrea_ala_p_cm,0,blade,Blade Abundance – Alaria (ind/cm²),Ostrea Blade Ab - Ala,2,2022-01-30_2
373,Pabay_30_1_22_2,2,Pabay,Saccharina,30/01/2022,30,1,2022,30/01/2022,pecten_ala_p_cm,0,blade,Blade Abundance – Alaria (ind/cm²),Pecten Blade Ab - Ala,2,2022-01-30_2
374,Pabay_30_1_22_2,2,Pabay,Saccharina,30/01/2022,30,1,2022,30/01/2022,scallop_brown_ala_p_cm,0,blade,Blade Abundance – Alaria (ind/cm²),Scallop Blade Ab - Ala,2,2022-01-30_2
375,Pabay_30_1_22_2,2,Pabay,Saccharina,30/01/2022,30,1,2022,30/01/2022,bivalve_ala_p_cm,0,blade,Blade Abundance – Alaria (ind/cm²),Bivalvia Blade Ab - Ala,2,2022-01-30_2
381,Pabay_30_1_22_3,3,Pabay,Saccharina,30/01/2022,30,1,2022,30/01/2022,mytilus_ala_p_cm,0,blade,Blade Abundance – Alaria (ind/cm²),Mytilus Blade Ab - Ala,3,2022-01-30_3
382,Pabay_30_1_22_3,3,Pabay,Saccharina,30/01/2022,30,1,2022,30/01/2022,ostrea_ala_p_cm,0,blade,Blade Abundance – Alaria (ind/cm²),Ostrea Blade Ab - Ala,3,2022-01-30_3
383,Pabay_30_1_22_3,3,Pabay,Saccharina,30/01/2022,30,1,2022,30/01/2022,pecten_ala_p_cm,0,blade,Blade Abundance – Alaria (ind/cm²),Pecten Blade Ab - Ala,3,2022-01-30_3
384,Pabay_30_1_22_3,3,Pabay,Saccharina,30/01/2022,30,1,2022,30/01/2022,scallop_brown_ala_p_cm,0,blade,Blade Abundance – Alaria (ind/cm²),Scallop Blade Ab - Ala,3,2022-01-30_3
385,Pabay_30_1_22_3,3,Pabay,Saccharina,30/01/2022,30,1,2022,30/01/2022,bivalve_ala_p_cm,0,blade,Blade Abundance – Alaria (ind/cm²),Bivalvia Blade Ab - Ala,3,2022-01-30_3
482,Pabay_7_5_22_1,1,Pabay,Alaria,07/05/2022,7,5,2022,07/05/2022,ostrea_ala_p_cm,0,blade,Blade Abundance – Alaria (ind/cm²),Ostrea Blade Ab - Ala,1,2022-05-07_1
483,Pabay_7_5_22_1,1,Pabay,Alaria,07/05/2022,7,5,2022,07/05/2022,pecten_ala_p_cm,0,blade,Blade Abundance – Alaria (ind/cm²),Pecten Blade Ab - Ala,1,2022-05-07_1
484,Pabay_7_5_22_1,1,Pabay,Alaria,07/05/2022,7,5,2022,07/05/2022,scallop_brown_ala_p_cm,0,blade,Blade Abundance – Alaria (ind/cm²),Scallop Blade Ab - Ala,1,2022-05-07_1
491,Pabay_7_5_22_2,2,Pabay,Alaria,07/05/2022,7,5,2022,07/05/2022,mytilus_ala_p_cm,0,blade,Blade Abundance – Alaria (ind/cm²),Mytilus Blade Ab - Ala,2,2022-05-07_2
492,Pabay_7_5_22_2,2,Pabay,Alaria,07/05/2022,7,5,2022,07/05/2022,ostrea_ala_p_cm,0,blade,Blade Abundance – Alaria (ind/cm²),Ostrea Blade Ab - Ala,2,2022-05-07_2
493,Pabay_7_5_22_2,2,Pabay,Alaria,07/05/2022,7,5,2022,07/05/2022,pecten_ala_p_cm,0,blade,Blade Abundance – Alaria (ind/cm²),Pecten Blade Ab - Ala,2,2022-05-07_2
494,Pabay_7_5_22_2,2,Pabay,Alaria,07/05/2022,7,5,2022,07/05/2022,scallop_brown_ala_p_cm,0,blade,Blade Abundance – Alaria (ind/cm²),Scallop Blade Ab - Ala,2,2022-05-07_2
495,Pabay_7_5_22_2,2,Pabay,Alaria,07/05/2022,7,5,2022,07/05/2022,bivalve_ala_p_cm,0,blade,Blade Abundance – Alaria (ind/cm²),Bivalvia Blade Ab - Ala,2,2022-05-07_2
501,Pabay_7_5_22_3,3,Pabay,Alaria,07/05/2022,7,5,2022,07/05/2022,mytilus_ala_p_cm,0,blade,Blade Abundance – Alaria (ind/cm²),Mytilus Blade Ab - Ala,3,2022-05-07_3
502,Pabay_7_5_22_3,3,Pabay,Alaria,07/05/2022,7,5,2022,07/05/2022,ostrea_ala_p_cm,0,blade,Blade Abundance – Alaria (ind/cm²),Ostrea Blade Ab - Ala,3,2022-05-07_3
503,Pabay_7_5_22_3,3,Pabay,Alaria,07/05/2022,7,5,2022,07/05/2022,pecten_ala_p_cm,0,blade,Blade Abundance – Alaria (ind/cm²),Pecten Blade Ab - Ala,3,2022-05-07_3
504,Pabay_7_5_22_3,3,Pabay,Alaria,07/05/2022,7,5,2022,07/05/2022,scallop_brown_ala_p_cm,0,blade,Blade Abundance – Alaria (ind/cm²),Scallop Blade Ab - Ala,3,2022-05-07_3
505,Pabay_7_5_22_3,3,Pabay,Alaria,07/05/2022,7,5,2022,07/05/2022,bivalve_ala_p_cm,0,blade,Blade Abundance – Alaria (ind/cm²),Bivalvia Blade Ab - Ala,3,2022-05-07_3
541,Pabay_8_3_22_1,1,Pabay,Saccharina,08/03/2022,8,3,2022,08/03/2022,mytilus_ala_p_cm,0,blade,Blade Abundance – Alaria (ind/cm²),Mytilus Blade Ab - Ala,1,2022-03-08_1
542,Pabay_8_3_22_1,1,Pabay,Saccharina,08/03/2022,8,3,2022,08/03/2022,ostrea_ala_p_cm,0,blade,Blade Abundance – Alaria (ind/cm²),Ostrea Blade Ab - Ala,1,2022-03-08_1
543,Pabay_8_3_22_1,1,Pabay,Saccharina,08/03/2022,8,3,2022,08/03/2022,pecten_ala_p_cm,0,blade,Blade Abundance – Alaria (ind/cm²),Pecten Blade Ab - Ala,1,2022-03-08_1
544,Pabay_8_3_22_1,1,Pabay,Saccharina,08/03/2022,8,3,2022,08/03/2022,scallop_brown_ala_p_cm,0,blade,Blade Abundance – Alaria (ind/cm²),Scallop Blade Ab - Ala,1,2022-03-08_1
551,Pabay_8_3_22_2,2,Pabay,Saccharina,08/03/2022,8,3,2022,08/03/2022,mytilus_ala_p_cm,0,blade,Blade Abundance – Alaria (ind/cm²),Mytilus Blade Ab - Ala,2,2022-03-08_2
552,Pabay_8_3_22_2,2,Pabay,Saccharina,08/03/2022,8,3,2022,08/03/2022,ostrea_ala_p_cm,0,blade,Blade Abundance – Alaria (ind/cm²),Ostrea Blade Ab - Ala,2,2022-03-08_2
553,Pabay_8_3_22_2,2,Pabay,Saccharina,08/03/2022,8,3,2022,08/03/2022,pecten_ala_p_cm,0,blade,Blade Abundance – Alaria (ind/cm²),Pecten Blade Ab - Ala,2,2022-03-08_2
554,Pabay_8_3_22_2,2,Pabay,Saccharina,08/03/2022,8,3,2022,08/03/2022,scallop_brown_ala_p_cm,0,blade,Blade Abundance – Alaria (ind/cm²),Scallop Blade Ab - Ala,2,2022-03-08_2
561,Pabay_8_3_22_3,3,Pabay,Saccharina,08/03/2022,8,3,2022,08/03/2022,mytilus_ala_p_cm,0,blade,Blade Abundance – Alaria (ind/cm²),Mytilus Blade Ab - Ala,3,2022-03-08_3
562,Pabay_8_3_22_3,3,Pabay,Saccharina,08/03/2022,8,3,2022,08/03/2022,ostrea_ala_p_cm,0,blade,Blade Abundance – Alaria (ind/cm²),Ostrea Blade Ab - Ala,3,2022-03-08_3
563,Pabay_8_3_22_3,3,Pabay,Saccharina,08/03/2022,8,3,2022,08/03/2022,pecten_ala_p_cm,0,blade,Blade Abundance – Alaria (ind/cm²),Pecten Blade Ab - Ala,3,2022-03-08_3
564,Pabay_8_3_22_3,3,Pabay,Saccharina,08/03/2022,8,3,2022,08/03/2022,scallop_brown_ala_p_cm,0,blade,Blade Abundance – Alaria (ind/cm²),Scallop Blade Ab - Ala,3,2022-03-08_3
295,Pabay_22_5_22_3,3,Pabay,Alaria,22/05/2022,22,5,2022,22/05/2022,bivalve_ala_p_cm,0.000557414,blade,Blade Abundance – Alaria (ind/cm²),Bivalvia Blade Ab - Ala,3,2022-05-22_3
285,Pabay_22_5_22_2,2,Pabay,Alaria,22/05/2022,22,5,2022,22/05/2022,bivalve_ala_p_cm,0.000566893,blade,Blade Abundance – Alaria (ind/cm²),Bivalvia Blade Ab - Ala,2,2022-05-22_2
481,Pabay_7_5_22_1,1,Pabay,Alaria,07/05/2022,7,5,2022,07/05/2022,mytilus_ala_p_cm,0.000738552,blade,Blade Abundance – Alaria (ind/cm²),Mytilus Blade Ab - Ala,1,2022-05-07_1
485,Pabay_7_5_22_1,1,Pabay,Alaria,07/05/2022,7,5,2022,07/05/2022,bivalve_ala_p_cm,0.000738552,blade,Blade Abundance – Alaria (ind/cm²),Bivalvia Blade Ab - Ala,1,2022-05-07_1
53,Pabay_10_4_22_3,3,Pabay,Alaria,10/04/2022,10,4,2022,10/04/2022,pecten_ala_p_cm,0.001503759,blade,Blade Abundance – Alaria (ind/cm²),Pecten Blade Ab - Ala,3,2022-04-10_3
55,Pabay_10_4_22_3,3,Pabay,Alaria,10/04/2022,10,4,2022,10/04/2022,bivalve_ala_p_cm,0.001503759,blade,Blade Abundance – Alaria (ind/cm²),Bivalvia Blade Ab - Ala,3,2022-04-10_3
41,Pabay_10_4_22_2,2,Pabay,Alaria,10/04/2022,10,4,2022,10/04/2022,mytilus_ala_p_cm,0.002906977,blade,Blade Abundance – Alaria (ind/cm²),Mytilus Blade Ab - Ala,2,2022-04-10_2
35,Pabay_10_4_22_1,1,Pabay,Alaria,10/04/2022,10,4,2022,10/04/2022,bivalve_ala_p_cm,0.002941176,blade,Blade Abundance – Alaria (ind/cm²),Bivalvia Blade Ab - Ala,1,2022-04-10_1
292,Pabay_22_5_22_3,3,Pabay,Alaria,22/05/2022,22,5,2022,22/05/2022,ostrea_ala_p_cm,0.003344482,blade,Blade Abundance – Alaria (ind/cm²),Ostrea Blade Ab - Ala,3,2022-05-22_3
282,Pabay_22_5_22_2,2,Pabay,Alaria,22/05/2022,22,5,2022,22/05/2022,ostrea_ala_p_cm,0.004251701,blade,Blade Abundance – Alaria (ind/cm²),Ostrea Blade Ab - Ala,2,2022-05-22_2
545,Pabay_8_3_22_1,1,Pabay,Saccharina,08/03/2022,8,3,2022,08/03/2022,bivalve_ala_p_cm,0.133377793,blade,Blade Abundance – Alaria (ind/cm²),Bivalvia Blade Ab - Ala,1,2022-03-08_1
555,Pabay_8_3_22_2,2,Pabay,Saccharina,08/03/2022,8,3,2022,08/03/2022,bivalve_ala_p_cm,0.133377793,blade,Blade Abundance – Alaria (ind/cm²),Bivalvia Blade Ab - Ala,2,2022-03-08_2
565,Pabay_8_3_22_3,3,Pabay,Saccharina,08/03/2022,8,3,2022,08/03/2022,bivalve_ala_p_cm,0.133377793,blade,Blade Abundance – Alaria (ind/cm²),Bivalvia Blade Ab - Ala,3,2022-03-08_3
1,Pabay_10_12_21_1,1,Pabay,Alaria,10/12/2021,10,12,2021,10/12/2021,mytilus_ala_p_cm,NA,blade,Blade Abundance – Alaria (ind/cm²),Mytilus Blade Ab - Ala,1,2021-12-10_1
2,Pabay_10_12_21_1,1,Pabay,Alaria,10/12/2021,10,12,2021,10/12/2021,ostrea_ala_p_cm,NA,blade,Blade Abundance – Alaria (ind/cm²),Ostrea Blade Ab - Ala,1,2021-12-10_1
3,Pabay_10_12_21_1,1,Pabay,Alaria,10/12/2021,10,12,2021,10/12/2021,pecten_ala_p_cm,NA,blade,Blade Abundance – Alaria (ind/cm²),Pecten Blade Ab - Ala,1,2021-12-10_1
4,Pabay_10_12_21_1,1,Pabay,Alaria,10/12/2021,10,12,2021,10/12/2021,scallop_brown_ala_p_cm,NA,blade,Blade Abundance – Alaria (ind/cm²),Scallop Blade Ab - Ala,1,2021-12-10_1
5,Pabay_10_12_21_1,1,Pabay,Alaria,10/12/2021,10,12,2021,10/12/2021,bivalve_ala_p_cm,NA,blade,Blade Abundance – Alaria (ind/cm²),Bivalvia Blade Ab - Ala,1,2021-12-10_1
6,Pabay_10_12_21_1,1,Pabay,Saccharina,10/12/2021,10,12,2021,10/12/2021,mytilus_ala_p_cm,NA,blade,Blade Abundance – Alaria (ind/cm²),Mytilus Blade Ab - Ala,1,2021-12-10_1
7,Pabay_10_12_21_1,1,Pabay,Saccharina,10/12/2021,10,12,2021,10/12/2021,ostrea_ala_p_cm,NA,blade,Blade Abundance – Alaria (ind/cm²),Ostrea Blade Ab - Ala,1,2021-12-10_1
8,Pabay_10_12_21_1,1,Pabay,Saccharina,10/12/2021,10,12,2021,10/12/2021,pecten_ala_p_cm,NA,blade,Blade Abundance – Alaria (ind/cm²),Pecten Blade Ab - Ala,1,2021-12-10_1
9,Pabay_10_12_21_1,1,Pabay,Saccharina,10/12/2021,10,12,2021,10/12/2021,scallop_brown_ala_p_cm,NA,blade,Blade Abundance – Alaria (ind/cm²),Scallop Blade Ab - Ala,1,2021-12-10_1
10,Pabay_10_12_21_1,1,Pabay,Saccharina,10/12/2021,10,12,2021,10/12/2021,bivalve_ala_p_cm,NA,blade,Blade Abundance – Alaria (ind/cm²),Bivalvia Blade Ab - Ala,1,2021-12-10_1
11,Pabay_10_12_21_2,2,Pabay,Alaria,10/12/2021,10,12,2021,10/12/2021,mytilus_ala_p_cm,NA,blade,Blade Abundance – Alaria (ind/cm²),Mytilus Blade Ab - Ala,2,2021-12-10_2
12,Pabay_10_12_21_2,2,Pabay,Alaria,10/12/2021,10,12,2021,10/12/2021,ostrea_ala_p_cm,NA,blade,Blade Abundance – Alaria (ind/cm²),Ostrea Blade Ab - Ala,2,2021-12-10_2
13,Pabay_10_12_21_2,2,Pabay,Alaria,10/12/2021,10,12,2021,10/12/2021,pecten_ala_p_cm,NA,blade,Blade Abundance – Alaria (ind/cm²),Pecten Blade Ab - Ala,2,2021-12-10_2
14,Pabay_10_12_21_2,2,Pabay,Alaria,10/12/2021,10,12,2021,10/12/2021,scallop_brown_ala_p_cm,NA,blade,Blade Abundance – Alaria (ind/cm²),Scallop Blade Ab - Ala,2,2021-12-10_2
15,Pabay_10_12_21_2,2,Pabay,Alaria,10/12/2021,10,12,2021,10/12/2021,bivalve_ala_p_cm,NA,blade,Blade Abundance – Alaria (ind/cm²),Bivalvia Blade Ab - Ala,2,2021-12-10_2
16,Pabay_10_12_21_2,2,Pabay,Saccharina,10/12/2021,10,12,2021,10/12/2021,mytilus_ala_p_cm,NA,blade,Blade Abundance – Alaria (ind/cm²),Mytilus Blade Ab - Ala,2,2021-12-10_2
17,Pabay_10_12_21_2,2,Pabay,Saccharina,10/12/2021,10,12,2021,10/12/2021,ostrea_ala_p_cm,NA,blade,Blade Abundance – Alaria (ind/cm²),Ostrea Blade Ab - Ala,2,2021-12-10_2
18,Pabay_10_12_21_2,2,Pabay,Saccharina,10/12/2021,10,12,2021,10/12/2021,pecten_ala_p_cm,NA,blade,Blade Abundance – Alaria (ind/cm²),Pecten Blade Ab - Ala,2,2021-12-10_2
19,Pabay_10_12_21_2,2,Pabay,Saccharina,10/12/2021,10,12,2021,10/12/2021,scallop_brown_ala_p_cm,NA,blade,Blade Abundance – Alaria (ind/cm²),Scallop Blade Ab - Ala,2,2021-12-10_2
20,Pabay_10_12_21_2,2,Pabay,Saccharina,10/12/2021,10,12,2021,10/12/2021,bivalve_ala_p_cm,NA,blade,Blade Abundance – Alaria (ind/cm²),Bivalvia Blade Ab - Ala,2,2021-12-10_2
21,Pabay_10_12_21_3,3,Pabay,Alaria,10/12/2021,10,12,2021,10/12/2021,mytilus_ala_p_cm,NA,blade,Blade Abundance – Alaria (ind/cm²),Mytilus Blade Ab - Ala,3,2021-12-10_3
22,Pabay_10_12_21_3,3,Pabay,Alaria,10/12/2021,10,12,2021,10/12/2021,ostrea_ala_p_cm,NA,blade,Blade Abundance – Alaria (ind/cm²),Ostrea Blade Ab - Ala,3,2021-12-10_3
23,Pabay_10_12_21_3,3,Pabay,Alaria,10/12/2021,10,12,2021,10/12/2021,pecten_ala_p_cm,NA,blade,Blade Abundance – Alaria (ind/cm²),Pecten Blade Ab - Ala,3,2021-12-10_3
24,Pabay_10_12_21_3,3,Pabay,Alaria,10/12/2021,10,12,2021,10/12/2021,scallop_brown_ala_p_cm,NA,blade,Blade Abundance – Alaria (ind/cm²),Scallop Blade Ab - Ala,3,2021-12-10_3
25,Pabay_10_12_21_3,3,Pabay,Alaria,10/12/2021,10,12,2021,10/12/2021,bivalve_ala_p_cm,NA,blade,Blade Abundance – Alaria (ind/cm²),Bivalvia Blade Ab - Ala,3,2021-12-10_3
26,Pabay_10_12_21_3,3,Pabay,Saccharina,10/12/2021,10,12,2021,10/12/2021,mytilus_ala_p_cm,NA,blade,Blade Abundance – Alaria (ind/cm²),Mytilus Blade Ab - Ala,3,2021-12-10_3
27,Pabay_10_12_21_3,3,Pabay,Saccharina,10/12/2021,10,12,2021,10/12/2021,ostrea_ala_p_cm,NA,blade,Blade Abundance – Alaria (ind/cm²),Ostrea Blade Ab - Ala,3,2021-12-10_3
28,Pabay_10_12_21_3,3,Pabay,Saccharina,10/12/2021,10,12,2021,10/12/2021,pecten_ala_p_cm,NA,blade,Blade Abundance – Alaria (ind/cm²),Pecten Blade Ab - Ala,3,2021-12-10_3
29,Pabay_10_12_21_3,3,Pabay,Saccharina,10/12/2021,10,12,2021,10/12/2021,scallop_brown_ala_p_cm,NA,blade,Blade Abundance – Alaria (ind/cm²),Scallop Blade Ab - Ala,3,2021-12-10_3
30,Pabay_10_12_21_3,3,Pabay,Saccharina,10/12/2021,10,12,2021,10/12/2021,bivalve_ala_p_cm,NA,blade,Blade Abundance – Alaria (ind/cm²),Bivalvia Blade Ab - Ala,3,2021-12-10_3
36,Pabay_10_4_22_1,1,Pabay,Saccharina,10/04/2022,10,4,2022,10/04/2022,mytilus_ala_p_cm,NA,blade,Blade Abundance – Alaria (ind/cm²),Mytilus Blade Ab - Ala,1,2022-04-10_1
37,Pabay_10_4_22_1,1,Pabay,Saccharina,10/04/2022,10,4,2022,10/04/2022,ostrea_ala_p_cm,NA,blade,Blade Abundance – Alaria (ind/cm²),Ostrea Blade Ab - Ala,1,2022-04-10_1
38,Pabay_10_4_22_1,1,Pabay,Saccharina,10/04/2022,10,4,2022,10/04/2022,pecten_ala_p_cm,NA,blade,Blade Abundance – Alaria (ind/cm²),Pecten Blade Ab - Ala,1,2022-04-10_1
39,Pabay_10_4_22_1,1,Pabay,Saccharina,10/04/2022,10,4,2022,10/04/2022,scallop_brown_ala_p_cm,NA,blade,Blade Abundance – Alaria (ind/cm²),Scallop Blade Ab - Ala,1,2022-04-10_1
40,Pabay_10_4_22_1,1,Pabay,Saccharina,10/04/2022,10,4,2022,10/04/2022,bivalve_ala_p_cm,NA,blade,Blade Abundance – Alaria (ind/cm²),Bivalvia Blade Ab - Ala,1,2022-04-10_1
46,Pabay_10_4_22_2,2,Pabay,Saccharina,10/04/2022,10,4,2022,10/04/2022,mytilus_ala_p_cm,NA,blade,Blade Abundance – Alaria (ind/cm²),Mytilus Blade Ab - Ala,2,2022-04-10_2
47,Pabay_10_4_22_2,2,Pabay,Saccharina,10/04/2022,10,4,2022,10/04/2022,ostrea_ala_p_cm,NA,blade,Blade Abundance – Alaria (ind/cm²),Ostrea Blade Ab - Ala,2,2022-04-10_2
48,Pabay_10_4_22_2,2,Pabay,Saccharina,10/04/2022,10,4,2022,10/04/2022,pecten_ala_p_cm,NA,blade,Blade Abundance – Alaria (ind/cm²),Pecten Blade Ab - Ala,2,2022-04-10_2
49,Pabay_10_4_22_2,2,Pabay,Saccharina,10/04/2022,10,4,2022,10/04/2022,scallop_brown_ala_p_cm,NA,blade,Blade Abundance – Alaria (ind/cm²),Scallop Blade Ab - Ala,2,2022-04-10_2
50,Pabay_10_4_22_2,2,Pabay,Saccharina,10/04/2022,10,4,2022,10/04/2022,bivalve_ala_p_cm,NA,blade,Blade Abundance – Alaria (ind/cm²),Bivalvia Blade Ab - Ala,2,2022-04-10_2
56,Pabay_10_4_22_3,3,Pabay,Saccharina,10/04/2022,10,4,2022,10/04/2022,mytilus_ala_p_cm,NA,blade,Blade Abundance – Alaria (ind/cm²),Mytilus Blade Ab - Ala,3,2022-04-10_3
57,Pabay_10_4_22_3,3,Pabay,Saccharina,10/04/2022,10,4,2022,10/04/2022,ostrea_ala_p_cm,NA,blade,Blade Abundance – Alaria (ind/cm²),Ostrea Blade Ab - Ala,3,2022-04-10_3
58,Pabay_10_4_22_3,3,Pabay,Saccharina,10/04/2022,10,4,2022,10/04/2022,pecten_ala_p_cm,NA,blade,Blade Abundance – Alaria (ind/cm²),Pecten Blade Ab - Ala,3,2022-04-10_3
59,Pabay_10_4_22_3,3,Pabay,Saccharina,10/04/2022,10,4,2022,10/04/2022,scallop_brown_ala_p_cm,NA,blade,Blade Abundance – Alaria (ind/cm²),Scallop Blade Ab - Ala,3,2022-04-10_3
60,Pabay_10_4_22_3,3,Pabay,Saccharina,10/04/2022,10,4,2022,10/04/2022,bivalve_ala_p_cm,NA,blade,Blade Abundance – Alaria (ind/cm²),Bivalvia Blade Ab - Ala,3,2022-04-10_3
61,Pabay_13_11_21_1,1,Pabay,Alaria,13/11/2021,13,11,2021,13/11/2021,mytilus_ala_p_cm,NA,blade,Blade Abundance – Alaria (ind/cm²),Mytilus Blade Ab - Ala,1,2021-11-13_1
62,Pabay_13_11_21_1,1,Pabay,Alaria,13/11/2021,13,11,2021,13/11/2021,ostrea_ala_p_cm,NA,blade,Blade Abundance – Alaria (ind/cm²),Ostrea Blade Ab - Ala,1,2021-11-13_1
63,Pabay_13_11_21_1,1,Pabay,Alaria,13/11/2021,13,11,2021,13/11/2021,pecten_ala_p_cm,NA,blade,Blade Abundance – Alaria (ind/cm²),Pecten Blade Ab - Ala,1,2021-11-13_1
64,Pabay_13_11_21_1,1,Pabay,Alaria,13/11/2021,13,11,2021,13/11/2021,scallop_brown_ala_p_cm,NA,blade,Blade Abundance – Alaria (ind/cm²),Scallop Blade Ab - Ala,1,2021-11-13_1
65,Pabay_13_11_21_1,1,Pabay,Alaria,13/11/2021,13,11,2021,13/11/2021,bivalve_ala_p_cm,NA,blade,Blade Abundance – Alaria (ind/cm²),Bivalvia Blade Ab - Ala,1,2021-11-13_1
66,Pabay_13_11_21_1,1,Pabay,Saccharina,13/11/2021,13,11,2021,13/11/2021,mytilus_ala_p_cm,NA,blade,Blade Abundance – Alaria (ind/cm²),Mytilus Blade Ab - Ala,1,2021-11-13_1
67,Pabay_13_11_21_1,1,Pabay,Saccharina,13/11/2021,13,11,2021,13/11/2021,ostrea_ala_p_cm,NA,blade,Blade Abundance – Alaria (ind/cm²),Ostrea Blade Ab - Ala,1,2021-11-13_1
68,Pabay_13_11_21_1,1,Pabay,Saccharina,13/11/2021,13,11,2021,13/11/2021,pecten_ala_p_cm,NA,blade,Blade Abundance – Alaria (ind/cm²),Pecten Blade Ab - Ala,1,2021-11-13_1
69,Pabay_13_11_21_1,1,Pabay,Saccharina,13/11/2021,13,11,2021,13/11/2021,scallop_brown_ala_p_cm,NA,blade,Blade Abundance – Alaria (ind/cm²),Scallop Blade Ab - Ala,1,2021-11-13_1
70,Pabay_13_11_21_1,1,Pabay,Saccharina,13/11/2021,13,11,2021,13/11/2021,bivalve_ala_p_cm,NA,blade,Blade Abundance – Alaria (ind/cm²),Bivalvia Blade Ab - Ala,1,2021-11-13_1
71,Pabay_13_11_21_2,2,Pabay ,Alaria,13/11/2021,13,11,2021,13/11/2021,mytilus_ala_p_cm,NA,blade,Blade Abundance – Alaria (ind/cm²),Mytilus Blade Ab - Ala,2,2021-11-13_2
72,Pabay_13_11_21_2,2,Pabay ,Alaria,13/11/2021,13,11,2021,13/11/2021,ostrea_ala_p_cm,NA,blade,Blade Abundance – Alaria (ind/cm²),Ostrea Blade Ab - Ala,2,2021-11-13_2
73,Pabay_13_11_21_2,2,Pabay ,Alaria,13/11/2021,13,11,2021,13/11/2021,pecten_ala_p_cm,NA,blade,Blade Abundance – Alaria (ind/cm²),Pecten Blade Ab - Ala,2,2021-11-13_2
74,Pabay_13_11_21_2,2,Pabay ,Alaria,13/11/2021,13,11,2021,13/11/2021,scallop_brown_ala_p_cm,NA,blade,Blade Abundance – Alaria (ind/cm²),Scallop Blade Ab - Ala,2,2021-11-13_2
75,Pabay_13_11_21_2,2,Pabay ,Alaria,13/11/2021,13,11,2021,13/11/2021,bivalve_ala_p_cm,NA,blade,Blade Abundance – Alaria (ind/cm²),Bivalvia Blade Ab - Ala,2,2021-11-13_2
76,Pabay_13_11_21_2,2,Pabay ,Saccharina,13/11/2021,13,11,2021,13/11/2021,mytilus_ala_p_cm,NA,blade,Blade Abundance – Alaria (ind/cm²),Mytilus Blade Ab - Ala,2,2021-11-13_2
77,Pabay_13_11_21_2,2,Pabay ,Saccharina,13/11/2021,13,11,2021,13/11/2021,ostrea_ala_p_cm,NA,blade,Blade Abundance – Alaria (ind/cm²),Ostrea Blade Ab - Ala,2,2021-11-13_2
78,Pabay_13_11_21_2,2,Pabay ,Saccharina,13/11/2021,13,11,2021,13/11/2021,pecten_ala_p_cm,NA,blade,Blade Abundance – Alaria (ind/cm²),Pecten Blade Ab - Ala,2,2021-11-13_2
79,Pabay_13_11_21_2,2,Pabay ,Saccharina,13/11/2021,13,11,2021,13/11/2021,scallop_brown_ala_p_cm,NA,blade,Blade Abundance – Alaria (ind/cm²),Scallop Blade Ab - Ala,2,2021-11-13_2
80,Pabay_13_11_21_2,2,Pabay ,Saccharina,13/11/2021,13,11,2021,13/11/2021,bivalve_ala_p_cm,NA,blade,Blade Abundance – Alaria (ind/cm²),Bivalvia Blade Ab - Ala,2,2021-11-13_2
81,Pabay_13_11_21_3,3,Pabay,Alaria,13/11/2021,13,11,2021,13/11/2021,mytilus_ala_p_cm,NA,blade,Blade Abundance – Alaria (ind/cm²),Mytilus Blade Ab - Ala,3,2021-11-13_3
82,Pabay_13_11_21_3,3,Pabay,Alaria,13/11/2021,13,11,2021,13/11/2021,ostrea_ala_p_cm,NA,blade,Blade Abundance – Alaria (ind/cm²),Ostrea Blade Ab - Ala,3,2021-11-13_3
83,Pabay_13_11_21_3,3,Pabay,Alaria,13/11/2021,13,11,2021,13/11/2021,pecten_ala_p_cm,NA,blade,Blade Abundance – Alaria (ind/cm²),Pecten Blade Ab - Ala,3,2021-11-13_3
84,Pabay_13_11_21_3,3,Pabay,Alaria,13/11/2021,13,11,2021,13/11/2021,scallop_brown_ala_p_cm,NA,blade,Blade Abundance – Alaria (ind/cm²),Scallop Blade Ab - Ala,3,2021-11-13_3
85,Pabay_13_11_21_3,3,Pabay,Alaria,13/11/2021,13,11,2021,13/11/2021,bivalve_ala_p_cm,NA,blade,Blade Abundance – Alaria (ind/cm²),Bivalvia Blade Ab - Ala,3,2021-11-13_3
86,Pabay_13_11_21_3,3,Pabay,Saccharina,13/11/2021,13,11,2021,13/11/2021,mytilus_ala_p_cm,NA,blade,Blade Abundance – Alaria (ind/cm²),Mytilus Blade Ab - Ala,3,2021-11-13_3
87,Pabay_13_11_21_3,3,Pabay,Saccharina,13/11/2021,13,11,2021,13/11/2021,ostrea_ala_p_cm,NA,blade,Blade Abundance – Alaria (ind/cm²),Ostrea Blade Ab - Ala,3,2021-11-13_3
88,Pabay_13_11_21_3,3,Pabay,Saccharina,13/11/2021,13,11,2021,13/11/2021,pecten_ala_p_cm,NA,blade,Blade Abundance – Alaria (ind/cm²),Pecten Blade Ab - Ala,3,2021-11-13_3
89,Pabay_13_11_21_3,3,Pabay,Saccharina,13/11/2021,13,11,2021,13/11/2021,scallop_brown_ala_p_cm,NA,blade,Blade Abundance – Alaria (ind/cm²),Scallop Blade Ab - Ala,3,2021-11-13_3
90,Pabay_13_11_21_3,3,Pabay,Saccharina,13/11/2021,13,11,2021,13/11/2021,bivalve_ala_p_cm,NA,blade,Blade Abundance – Alaria (ind/cm²),Bivalvia Blade Ab - Ala,3,2021-11-13_3
91,Pabay_14_1_22_1,1,Pabay,Alaria,14/01/2022,14,1,2022,14/01/2022,mytilus_ala_p_cm,NA,blade,Blade Abundance – Alaria (ind/cm²),Mytilus Blade Ab - Ala,1,2022-01-14_1
92,Pabay_14_1_22_1,1,Pabay,Alaria,14/01/2022,14,1,2022,14/01/2022,ostrea_ala_p_cm,NA,blade,Blade Abundance – Alaria (ind/cm²),Ostrea Blade Ab - Ala,1,2022-01-14_1
93,Pabay_14_1_22_1,1,Pabay,Alaria,14/01/2022,14,1,2022,14/01/2022,pecten_ala_p_cm,NA,blade,Blade Abundance – Alaria (ind/cm²),Pecten Blade Ab - Ala,1,2022-01-14_1
94,Pabay_14_1_22_1,1,Pabay,Alaria,14/01/2022,14,1,2022,14/01/2022,scallop_brown_ala_p_cm,NA,blade,Blade Abundance – Alaria (ind/cm²),Scallop Blade Ab - Ala,1,2022-01-14_1
95,Pabay_14_1_22_1,1,Pabay,Alaria,14/01/2022,14,1,2022,14/01/2022,bivalve_ala_p_cm,NA,blade,Blade Abundance – Alaria (ind/cm²),Bivalvia Blade Ab - Ala,1,2022-01-14_1
96,Pabay_14_1_22_1,1,Pabay,Saccharina,14/01/2022,14,1,2022,14/01/2022,mytilus_ala_p_cm,NA,blade,Blade Abundance – Alaria (ind/cm²),Mytilus Blade Ab - Ala,1,2022-01-14_1
97,Pabay_14_1_22_1,1,Pabay,Saccharina,14/01/2022,14,1,2022,14/01/2022,ostrea_ala_p_cm,NA,blade,Blade Abundance – Alaria (ind/cm²),Ostrea Blade Ab - Ala,1,2022-01-14_1
98,Pabay_14_1_22_1,1,Pabay,Saccharina,14/01/2022,14,1,2022,14/01/2022,pecten_ala_p_cm,NA,blade,Blade Abundance – Alaria (ind/cm²),Pecten Blade Ab - Ala,1,2022-01-14_1
99,Pabay_14_1_22_1,1,Pabay,Saccharina,14/01/2022,14,1,2022,14/01/2022,scallop_brown_ala_p_cm,NA,blade,Blade Abundance – Alaria (ind/cm²),Scallop Blade Ab - Ala,1,2022-01-14_1
100,Pabay_14_1_22_1,1,Pabay,Saccharina,14/01/2022,14,1,2022,14/01/2022,bivalve_ala_p_cm,NA,blade,Blade Abundance – Alaria (ind/cm²),Bivalvia Blade Ab - Ala,1,2022-01-14_1
101,Pabay_14_1_22_2,2,Pabay ,Alaria,14/01/2022,14,1,2022,14/01/2022,mytilus_ala_p_cm,NA,blade,Blade Abundance – Alaria (ind/cm²),Mytilus Blade Ab - Ala,2,2022-01-14_2
102,Pabay_14_1_22_2,2,Pabay ,Alaria,14/01/2022,14,1,2022,14/01/2022,ostrea_ala_p_cm,NA,blade,Blade Abundance – Alaria (ind/cm²),Ostrea Blade Ab - Ala,2,2022-01-14_2
103,Pabay_14_1_22_2,2,Pabay ,Alaria,14/01/2022,14,1,2022,14/01/2022,pecten_ala_p_cm,NA,blade,Blade Abundance – Alaria (ind/cm²),Pecten Blade Ab - Ala,2,2022-01-14_2
104,Pabay_14_1_22_2,2,Pabay ,Alaria,14/01/2022,14,1,2022,14/01/2022,scallop_brown_ala_p_cm,NA,blade,Blade Abundance – Alaria (ind/cm²),Scallop Blade Ab - Ala,2,2022-01-14_2
105,Pabay_14_1_22_2,2,Pabay ,Alaria,14/01/2022,14,1,2022,14/01/2022,bivalve_ala_p_cm,NA,blade,Blade Abundance – Alaria (ind/cm²),Bivalvia Blade Ab - Ala,2,2022-01-14_2
106,Pabay_14_1_22_2,2,Pabay ,Saccharina,14/01/2022,14,1,2022,14/01/2022,mytilus_ala_p_cm,NA,blade,Blade Abundance – Alaria (ind/cm²),Mytilus Blade Ab - Ala,2,2022-01-14_2
107,Pabay_14_1_22_2,2,Pabay ,Saccharina,14/01/2022,14,1,2022,14/01/2022,ostrea_ala_p_cm,NA,blade,Blade Abundance – Alaria (ind/cm²),Ostrea Blade Ab - Ala,2,2022-01-14_2
108,Pabay_14_1_22_2,2,Pabay ,Saccharina,14/01/2022,14,1,2022,14/01/2022,pecten_ala_p_cm,NA,blade,Blade Abundance – Alaria (ind/cm²),Pecten Blade Ab - Ala,2,2022-01-14_2
109,Pabay_14_1_22_2,2,Pabay ,Saccharina,14/01/2022,14,1,2022,14/01/2022,scallop_brown_ala_p_cm,NA,blade,Blade Abundance – Alaria (ind/cm²),Scallop Blade Ab - Ala,2,2022-01-14_2
110,Pabay_14_1_22_2,2,Pabay ,Saccharina,14/01/2022,14,1,2022,14/01/2022,bivalve_ala_p_cm,NA,blade,Blade Abundance – Alaria (ind/cm²),Bivalvia Blade Ab - Ala,2,2022-01-14_2
111,Pabay_14_1_22_3,3,Pabay,Alaria,14/01/2022,14,1,2022,14/01/2022,mytilus_ala_p_cm,NA,blade,Blade Abundance – Alaria (ind/cm²),Mytilus Blade Ab - Ala,3,2022-01-14_3
112,Pabay_14_1_22_3,3,Pabay,Alaria,14/01/2022,14,1,2022,14/01/2022,ostrea_ala_p_cm,NA,blade,Blade Abundance – Alaria (ind/cm²),Ostrea Blade Ab - Ala,3,2022-01-14_3
113,Pabay_14_1_22_3,3,Pabay,Alaria,14/01/2022,14,1,2022,14/01/2022,pecten_ala_p_cm,NA,blade,Blade Abundance – Alaria (ind/cm²),Pecten Blade Ab - Ala,3,2022-01-14_3
114,Pabay_14_1_22_3,3,Pabay,Alaria,14/01/2022,14,1,2022,14/01/2022,scallop_brown_ala_p_cm,NA,blade,Blade Abundance – Alaria (ind/cm²),Scallop Blade Ab - Ala,3,2022-01-14_3
115,Pabay_14_1_22_3,3,Pabay,Alaria,14/01/2022,14,1,2022,14/01/2022,bivalve_ala_p_cm,NA,blade,Blade Abundance – Alaria (ind/cm²),Bivalvia Blade Ab - Ala,3,2022-01-14_3
116,Pabay_14_1_22_3,3,Pabay,Saccharina,14/01/2022,14,1,2022,14/01/2022,mytilus_ala_p_cm,NA,blade,Blade Abundance – Alaria (ind/cm²),Mytilus Blade Ab - Ala,3,2022-01-14_3
117,Pabay_14_1_22_3,3,Pabay,Saccharina,14/01/2022,14,1,2022,14/01/2022,ostrea_ala_p_cm,NA,blade,Blade Abundance – Alaria (ind/cm²),Ostrea Blade Ab - Ala,3,2022-01-14_3
118,Pabay_14_1_22_3,3,Pabay,Saccharina,14/01/2022,14,1,2022,14/01/2022,pecten_ala_p_cm,NA,blade,Blade Abundance – Alaria (ind/cm²),Pecten Blade Ab - Ala,3,2022-01-14_3
119,Pabay_14_1_22_3,3,Pabay,Saccharina,14/01/2022,14,1,2022,14/01/2022,scallop_brown_ala_p_cm,NA,blade,Blade Abundance – Alaria (ind/cm²),Scallop Blade Ab - Ala,3,2022-01-14_3
120,Pabay_14_1_22_3,3,Pabay,Saccharina,14/01/2022,14,1,2022,14/01/2022,bivalve_ala_p_cm,NA,blade,Blade Abundance – Alaria (ind/cm²),Bivalvia Blade Ab - Ala,3,2022-01-14_3
121,Pabay_15_6_21_1,1,Pabay,Saccharina,15/06/2021,15,6,2021,15/06/2021,mytilus_ala_p_cm,NA,blade,Blade Abundance – Alaria (ind/cm²),Mytilus Blade Ab - Ala,1,2021-06-15_1
122,Pabay_15_6_21_1,1,Pabay,Saccharina,15/06/2021,15,6,2021,15/06/2021,ostrea_ala_p_cm,NA,blade,Blade Abundance – Alaria (ind/cm²),Ostrea Blade Ab - Ala,1,2021-06-15_1
123,Pabay_15_6_21_1,1,Pabay,Saccharina,15/06/2021,15,6,2021,15/06/2021,pecten_ala_p_cm,NA,blade,Blade Abundance – Alaria (ind/cm²),Pecten Blade Ab - Ala,1,2021-06-15_1
124,Pabay_15_6_21_1,1,Pabay,Saccharina,15/06/2021,15,6,2021,15/06/2021,scallop_brown_ala_p_cm,NA,blade,Blade Abundance – Alaria (ind/cm²),Scallop Blade Ab - Ala,1,2021-06-15_1
125,Pabay_15_6_21_1,1,Pabay,Saccharina,15/06/2021,15,6,2021,15/06/2021,bivalve_ala_p_cm,NA,blade,Blade Abundance – Alaria (ind/cm²),Bivalvia Blade Ab - Ala,1,2021-06-15_1
126,Pabay_15_6_21_1,1,Pabay,Alaria,15/06/2021,15,6,2021,15/06/2021,mytilus_ala_p_cm,NA,blade,Blade Abundance – Alaria (ind/cm²),Mytilus Blade Ab - Ala,1,2021-06-15_1
127,Pabay_15_6_21_1,1,Pabay,Alaria,15/06/2021,15,6,2021,15/06/2021,ostrea_ala_p_cm,NA,blade,Blade Abundance – Alaria (ind/cm²),Ostrea Blade Ab - Ala,1,2021-06-15_1
128,Pabay_15_6_21_1,1,Pabay,Alaria,15/06/2021,15,6,2021,15/06/2021,pecten_ala_p_cm,NA,blade,Blade Abundance – Alaria (ind/cm²),Pecten Blade Ab - Ala,1,2021-06-15_1
129,Pabay_15_6_21_1,1,Pabay,Alaria,15/06/2021,15,6,2021,15/06/2021,scallop_brown_ala_p_cm,NA,blade,Blade Abundance – Alaria (ind/cm²),Scallop Blade Ab - Ala,1,2021-06-15_1
130,Pabay_15_6_21_1,1,Pabay,Alaria,15/06/2021,15,6,2021,15/06/2021,bivalve_ala_p_cm,NA,blade,Blade Abundance – Alaria (ind/cm²),Bivalvia Blade Ab - Ala,1,2021-06-15_1
131,Pabay_15_6_21_2,2,Pabay,Saccharina,15/06/2021,15,6,2021,15/06/2021,mytilus_ala_p_cm,NA,blade,Blade Abundance – Alaria (ind/cm²),Mytilus Blade Ab - Ala,2,2021-06-15_2
132,Pabay_15_6_21_2,2,Pabay,Saccharina,15/06/2021,15,6,2021,15/06/2021,ostrea_ala_p_cm,NA,blade,Blade Abundance – Alaria (ind/cm²),Ostrea Blade Ab - Ala,2,2021-06-15_2
133,Pabay_15_6_21_2,2,Pabay,Saccharina,15/06/2021,15,6,2021,15/06/2021,pecten_ala_p_cm,NA,blade,Blade Abundance – Alaria (ind/cm²),Pecten Blade Ab - Ala,2,2021-06-15_2
134,Pabay_15_6_21_2,2,Pabay,Saccharina,15/06/2021,15,6,2021,15/06/2021,scallop_brown_ala_p_cm,NA,blade,Blade Abundance – Alaria (ind/cm²),Scallop Blade Ab - Ala,2,2021-06-15_2
135,Pabay_15_6_21_2,2,Pabay,Saccharina,15/06/2021,15,6,2021,15/06/2021,bivalve_ala_p_cm,NA,blade,Blade Abundance – Alaria (ind/cm²),Bivalvia Blade Ab - Ala,2,2021-06-15_2
136,Pabay_15_6_21_2,2,Pabay,Alaria,15/06/2021,15,6,2021,15/06/2021,mytilus_ala_p_cm,NA,blade,Blade Abundance – Alaria (ind/cm²),Mytilus Blade Ab - Ala,2,2021-06-15_2
137,Pabay_15_6_21_2,2,Pabay,Alaria,15/06/2021,15,6,2021,15/06/2021,ostrea_ala_p_cm,NA,blade,Blade Abundance – Alaria (ind/cm²),Ostrea Blade Ab - Ala,2,2021-06-15_2
138,Pabay_15_6_21_2,2,Pabay,Alaria,15/06/2021,15,6,2021,15/06/2021,pecten_ala_p_cm,NA,blade,Blade Abundance – Alaria (ind/cm²),Pecten Blade Ab - Ala,2,2021-06-15_2
139,Pabay_15_6_21_2,2,Pabay,Alaria,15/06/2021,15,6,2021,15/06/2021,scallop_brown_ala_p_cm,NA,blade,Blade Abundance – Alaria (ind/cm²),Scallop Blade Ab - Ala,2,2021-06-15_2
140,Pabay_15_6_21_2,2,Pabay,Alaria,15/06/2021,15,6,2021,15/06/2021,bivalve_ala_p_cm,NA,blade,Blade Abundance – Alaria (ind/cm²),Bivalvia Blade Ab - Ala,2,2021-06-15_2
141,Pabay_15_6_21_3,3,Pabay,Saccharina,15/06/2021,15,6,2021,15/06/2021,mytilus_ala_p_cm,NA,blade,Blade Abundance – Alaria (ind/cm²),Mytilus Blade Ab - Ala,3,2021-06-15_3
142,Pabay_15_6_21_3,3,Pabay,Saccharina,15/06/2021,15,6,2021,15/06/2021,ostrea_ala_p_cm,NA,blade,Blade Abundance – Alaria (ind/cm²),Ostrea Blade Ab - Ala,3,2021-06-15_3
143,Pabay_15_6_21_3,3,Pabay,Saccharina,15/06/2021,15,6,2021,15/06/2021,pecten_ala_p_cm,NA,blade,Blade Abundance – Alaria (ind/cm²),Pecten Blade Ab - Ala,3,2021-06-15_3
144,Pabay_15_6_21_3,3,Pabay,Saccharina,15/06/2021,15,6,2021,15/06/2021,scallop_brown_ala_p_cm,NA,blade,Blade Abundance – Alaria (ind/cm²),Scallop Blade Ab - Ala,3,2021-06-15_3
145,Pabay_15_6_21_3,3,Pabay,Saccharina,15/06/2021,15,6,2021,15/06/2021,bivalve_ala_p_cm,NA,blade,Blade Abundance – Alaria (ind/cm²),Bivalvia Blade Ab - Ala,3,2021-06-15_3
146,Pabay_15_6_21_3,3,Pabay,Alaria,15/06/2021,15,6,2021,15/06/2021,mytilus_ala_p_cm,NA,blade,Blade Abundance – Alaria (ind/cm²),Mytilus Blade Ab - Ala,3,2021-06-15_3
147,Pabay_15_6_21_3,3,Pabay,Alaria,15/06/2021,15,6,2021,15/06/2021,ostrea_ala_p_cm,NA,blade,Blade Abundance – Alaria (ind/cm²),Ostrea Blade Ab - Ala,3,2021-06-15_3
148,Pabay_15_6_21_3,3,Pabay,Alaria,15/06/2021,15,6,2021,15/06/2021,pecten_ala_p_cm,NA,blade,Blade Abundance – Alaria (ind/cm²),Pecten Blade Ab - Ala,3,2021-06-15_3
149,Pabay_15_6_21_3,3,Pabay,Alaria,15/06/2021,15,6,2021,15/06/2021,scallop_brown_ala_p_cm,NA,blade,Blade Abundance – Alaria (ind/cm²),Scallop Blade Ab - Ala,3,2021-06-15_3
150,Pabay_15_6_21_3,3,Pabay,Alaria,15/06/2021,15,6,2021,15/06/2021,bivalve_ala_p_cm,NA,blade,Blade Abundance – Alaria (ind/cm²),Bivalvia Blade Ab - Ala,3,2021-06-15_3
151,Pabay_15_7_22_1,1,Pabay,Alaria,15/07/2022,15,7,2022,15/07/2022,mytilus_ala_p_cm,NA,blade,Blade Abundance – Alaria (ind/cm²),Mytilus Blade Ab - Ala,1,2022-07-15_1
152,Pabay_15_7_22_1,1,Pabay,Alaria,15/07/2022,15,7,2022,15/07/2022,ostrea_ala_p_cm,NA,blade,Blade Abundance – Alaria (ind/cm²),Ostrea Blade Ab - Ala,1,2022-07-15_1
153,Pabay_15_7_22_1,1,Pabay,Alaria,15/07/2022,15,7,2022,15/07/2022,pecten_ala_p_cm,NA,blade,Blade Abundance – Alaria (ind/cm²),Pecten Blade Ab - Ala,1,2022-07-15_1
154,Pabay_15_7_22_1,1,Pabay,Alaria,15/07/2022,15,7,2022,15/07/2022,scallop_brown_ala_p_cm,NA,blade,Blade Abundance – Alaria (ind/cm²),Scallop Blade Ab - Ala,1,2022-07-15_1
155,Pabay_15_7_22_1,1,Pabay,Alaria,15/07/2022,15,7,2022,15/07/2022,bivalve_ala_p_cm,NA,blade,Blade Abundance – Alaria (ind/cm²),Bivalvia Blade Ab - Ala,1,2022-07-15_1
156,Pabay_15_7_22_1,1,Pabay,Saccharina,15/07/2022,15,7,2022,15/07/2022,mytilus_ala_p_cm,NA,blade,Blade Abundance – Alaria (ind/cm²),Mytilus Blade Ab - Ala,1,2022-07-15_1
157,Pabay_15_7_22_1,1,Pabay,Saccharina,15/07/2022,15,7,2022,15/07/2022,ostrea_ala_p_cm,NA,blade,Blade Abundance – Alaria (ind/cm²),Ostrea Blade Ab - Ala,1,2022-07-15_1
158,Pabay_15_7_22_1,1,Pabay,Saccharina,15/07/2022,15,7,2022,15/07/2022,pecten_ala_p_cm,NA,blade,Blade Abundance – Alaria (ind/cm²),Pecten Blade Ab - Ala,1,2022-07-15_1
159,Pabay_15_7_22_1,1,Pabay,Saccharina,15/07/2022,15,7,2022,15/07/2022,scallop_brown_ala_p_cm,NA,blade,Blade Abundance – Alaria (ind/cm²),Scallop Blade Ab - Ala,1,2022-07-15_1
160,Pabay_15_7_22_1,1,Pabay,Saccharina,15/07/2022,15,7,2022,15/07/2022,bivalve_ala_p_cm,NA,blade,Blade Abundance – Alaria (ind/cm²),Bivalvia Blade Ab - Ala,1,2022-07-15_1
161,Pabay_15_7_22_2,2,Pabay,Alaria,15/07/2022,15,7,2022,15/07/2022,mytilus_ala_p_cm,NA,blade,Blade Abundance – Alaria (ind/cm²),Mytilus Blade Ab - Ala,2,2022-07-15_2
162,Pabay_15_7_22_2,2,Pabay,Alaria,15/07/2022,15,7,2022,15/07/2022,ostrea_ala_p_cm,NA,blade,Blade Abundance – Alaria (ind/cm²),Ostrea Blade Ab - Ala,2,2022-07-15_2
163,Pabay_15_7_22_2,2,Pabay,Alaria,15/07/2022,15,7,2022,15/07/2022,pecten_ala_p_cm,NA,blade,Blade Abundance – Alaria (ind/cm²),Pecten Blade Ab - Ala,2,2022-07-15_2
164,Pabay_15_7_22_2,2,Pabay,Alaria,15/07/2022,15,7,2022,15/07/2022,scallop_brown_ala_p_cm,NA,blade,Blade Abundance – Alaria (ind/cm²),Scallop Blade Ab - Ala,2,2022-07-15_2
165,Pabay_15_7_22_2,2,Pabay,Alaria,15/07/2022,15,7,2022,15/07/2022,bivalve_ala_p_cm,NA,blade,Blade Abundance – Alaria (ind/cm²),Bivalvia Blade Ab - Ala,2,2022-07-15_2
166,Pabay_15_7_22_2,2,Pabay,Saccharina,15/07/2022,15,7,2022,15/07/2022,mytilus_ala_p_cm,NA,blade,Blade Abundance – Alaria (ind/cm²),Mytilus Blade Ab - Ala,2,2022-07-15_2
167,Pabay_15_7_22_2,2,Pabay,Saccharina,15/07/2022,15,7,2022,15/07/2022,ostrea_ala_p_cm,NA,blade,Blade Abundance – Alaria (ind/cm²),Ostrea Blade Ab - Ala,2,2022-07-15_2
168,Pabay_15_7_22_2,2,Pabay,Saccharina,15/07/2022,15,7,2022,15/07/2022,pecten_ala_p_cm,NA,blade,Blade Abundance – Alaria (ind/cm²),Pecten Blade Ab - Ala,2,2022-07-15_2
169,Pabay_15_7_22_2,2,Pabay,Saccharina,15/07/2022,15,7,2022,15/07/2022,scallop_brown_ala_p_cm,NA,blade,Blade Abundance – Alaria (ind/cm²),Scallop Blade Ab - Ala,2,2022-07-15_2
170,Pabay_15_7_22_2,2,Pabay,Saccharina,15/07/2022,15,7,2022,15/07/2022,bivalve_ala_p_cm,NA,blade,Blade Abundance – Alaria (ind/cm²),Bivalvia Blade Ab - Ala,2,2022-07-15_2
171,Pabay_15_7_22_3,3,Pabay,Alaria,15/07/2022,15,7,2022,15/07/2022,mytilus_ala_p_cm,NA,blade,Blade Abundance – Alaria (ind/cm²),Mytilus Blade Ab - Ala,3,2022-07-15_3
172,Pabay_15_7_22_3,3,Pabay,Alaria,15/07/2022,15,7,2022,15/07/2022,ostrea_ala_p_cm,NA,blade,Blade Abundance – Alaria (ind/cm²),Ostrea Blade Ab - Ala,3,2022-07-15_3
173,Pabay_15_7_22_3,3,Pabay,Alaria,15/07/2022,15,7,2022,15/07/2022,pecten_ala_p_cm,NA,blade,Blade Abundance – Alaria (ind/cm²),Pecten Blade Ab - Ala,3,2022-07-15_3
174,Pabay_15_7_22_3,3,Pabay,Alaria,15/07/2022,15,7,2022,15/07/2022,scallop_brown_ala_p_cm,NA,blade,Blade Abundance – Alaria (ind/cm²),Scallop Blade Ab - Ala,3,2022-07-15_3
175,Pabay_15_7_22_3,3,Pabay,Alaria,15/07/2022,15,7,2022,15/07/2022,bivalve_ala_p_cm,NA,blade,Blade Abundance – Alaria (ind/cm²),Bivalvia Blade Ab - Ala,3,2022-07-15_3
176,Pabay_15_7_22_3,3,Pabay,Saccharina,15/07/2022,15,7,2022,15/07/2022,mytilus_ala_p_cm,NA,blade,Blade Abundance – Alaria (ind/cm²),Mytilus Blade Ab - Ala,3,2022-07-15_3
177,Pabay_15_7_22_3,3,Pabay,Saccharina,15/07/2022,15,7,2022,15/07/2022,ostrea_ala_p_cm,NA,blade,Blade Abundance – Alaria (ind/cm²),Ostrea Blade Ab - Ala,3,2022-07-15_3
178,Pabay_15_7_22_3,3,Pabay,Saccharina,15/07/2022,15,7,2022,15/07/2022,pecten_ala_p_cm,NA,blade,Blade Abundance – Alaria (ind/cm²),Pecten Blade Ab - Ala,3,2022-07-15_3
179,Pabay_15_7_22_3,3,Pabay,Saccharina,15/07/2022,15,7,2022,15/07/2022,scallop_brown_ala_p_cm,NA,blade,Blade Abundance – Alaria (ind/cm²),Scallop Blade Ab - Ala,3,2022-07-15_3
180,Pabay_15_7_22_3,3,Pabay,Saccharina,15/07/2022,15,7,2022,15/07/2022,bivalve_ala_p_cm,NA,blade,Blade Abundance – Alaria (ind/cm²),Bivalvia Blade Ab - Ala,3,2022-07-15_3
181,Pabay_16_9_21_1,1,Pabay,Saccharina,16/09/2021,16,9,2021,16/09/2021,mytilus_ala_p_cm,NA,blade,Blade Abundance – Alaria (ind/cm²),Mytilus Blade Ab - Ala,1,2021-09-16_1
182,Pabay_16_9_21_1,1,Pabay,Saccharina,16/09/2021,16,9,2021,16/09/2021,ostrea_ala_p_cm,NA,blade,Blade Abundance – Alaria (ind/cm²),Ostrea Blade Ab - Ala,1,2021-09-16_1
183,Pabay_16_9_21_1,1,Pabay,Saccharina,16/09/2021,16,9,2021,16/09/2021,pecten_ala_p_cm,NA,blade,Blade Abundance – Alaria (ind/cm²),Pecten Blade Ab - Ala,1,2021-09-16_1
184,Pabay_16_9_21_1,1,Pabay,Saccharina,16/09/2021,16,9,2021,16/09/2021,scallop_brown_ala_p_cm,NA,blade,Blade Abundance – Alaria (ind/cm²),Scallop Blade Ab - Ala,1,2021-09-16_1
185,Pabay_16_9_21_1,1,Pabay,Saccharina,16/09/2021,16,9,2021,16/09/2021,bivalve_ala_p_cm,NA,blade,Blade Abundance – Alaria (ind/cm²),Bivalvia Blade Ab - Ala,1,2021-09-16_1
186,Pabay_16_9_21_1,1,Pabay,Alaria,16/09/2021,16,9,2021,16/09/2021,mytilus_ala_p_cm,NA,blade,Blade Abundance – Alaria (ind/cm²),Mytilus Blade Ab - Ala,1,2021-09-16_1
187,Pabay_16_9_21_1,1,Pabay,Alaria,16/09/2021,16,9,2021,16/09/2021,ostrea_ala_p_cm,NA,blade,Blade Abundance – Alaria (ind/cm²),Ostrea Blade Ab - Ala,1,2021-09-16_1
188,Pabay_16_9_21_1,1,Pabay,Alaria,16/09/2021,16,9,2021,16/09/2021,pecten_ala_p_cm,NA,blade,Blade Abundance – Alaria (ind/cm²),Pecten Blade Ab - Ala,1,2021-09-16_1
189,Pabay_16_9_21_1,1,Pabay,Alaria,16/09/2021,16,9,2021,16/09/2021,scallop_brown_ala_p_cm,NA,blade,Blade Abundance – Alaria (ind/cm²),Scallop Blade Ab - Ala,1,2021-09-16_1
190,Pabay_16_9_21_1,1,Pabay,Alaria,16/09/2021,16,9,2021,16/09/2021,bivalve_ala_p_cm,NA,blade,Blade Abundance – Alaria (ind/cm²),Bivalvia Blade Ab - Ala,1,2021-09-16_1
191,Pabay_16_9_21_2,2,Pabay,Saccharina,16/09/2021,16,9,2021,16/09/2021,mytilus_ala_p_cm,NA,blade,Blade Abundance – Alaria (ind/cm²),Mytilus Blade Ab - Ala,2,2021-09-16_2
192,Pabay_16_9_21_2,2,Pabay,Saccharina,16/09/2021,16,9,2021,16/09/2021,ostrea_ala_p_cm,NA,blade,Blade Abundance – Alaria (ind/cm²),Ostrea Blade Ab - Ala,2,2021-09-16_2
193,Pabay_16_9_21_2,2,Pabay,Saccharina,16/09/2021,16,9,2021,16/09/2021,pecten_ala_p_cm,NA,blade,Blade Abundance – Alaria (ind/cm²),Pecten Blade Ab - Ala,2,2021-09-16_2
194,Pabay_16_9_21_2,2,Pabay,Saccharina,16/09/2021,16,9,2021,16/09/2021,scallop_brown_ala_p_cm,NA,blade,Blade Abundance – Alaria (ind/cm²),Scallop Blade Ab - Ala,2,2021-09-16_2
195,Pabay_16_9_21_2,2,Pabay,Saccharina,16/09/2021,16,9,2021,16/09/2021,bivalve_ala_p_cm,NA,blade,Blade Abundance – Alaria (ind/cm²),Bivalvia Blade Ab - Ala,2,2021-09-16_2
196,Pabay_16_9_21_2,2,Pabay,Alaria,16/09/2021,16,9,2021,16/09/2021,mytilus_ala_p_cm,NA,blade,Blade Abundance – Alaria (ind/cm²),Mytilus Blade Ab - Ala,2,2021-09-16_2
197,Pabay_16_9_21_2,2,Pabay,Alaria,16/09/2021,16,9,2021,16/09/2021,ostrea_ala_p_cm,NA,blade,Blade Abundance – Alaria (ind/cm²),Ostrea Blade Ab - Ala,2,2021-09-16_2
198,Pabay_16_9_21_2,2,Pabay,Alaria,16/09/2021,16,9,2021,16/09/2021,pecten_ala_p_cm,NA,blade,Blade Abundance – Alaria (ind/cm²),Pecten Blade Ab - Ala,2,2021-09-16_2
199,Pabay_16_9_21_2,2,Pabay,Alaria,16/09/2021,16,9,2021,16/09/2021,scallop_brown_ala_p_cm,NA,blade,Blade Abundance – Alaria (ind/cm²),Scallop Blade Ab - Ala,2,2021-09-16_2
200,Pabay_16_9_21_2,2,Pabay,Alaria,16/09/2021,16,9,2021,16/09/2021,bivalve_ala_p_cm,NA,blade,Blade Abundance – Alaria (ind/cm²),Bivalvia Blade Ab - Ala,2,2021-09-16_2
201,Pabay_16_9_21_3,3,Pabay,Saccharina,16/09/2021,16,9,2021,16/09/2021,mytilus_ala_p_cm,NA,blade,Blade Abundance – Alaria (ind/cm²),Mytilus Blade Ab - Ala,3,2021-09-16_3
202,Pabay_16_9_21_3,3,Pabay,Saccharina,16/09/2021,16,9,2021,16/09/2021,ostrea_ala_p_cm,NA,blade,Blade Abundance – Alaria (ind/cm²),Ostrea Blade Ab - Ala,3,2021-09-16_3
203,Pabay_16_9_21_3,3,Pabay,Saccharina,16/09/2021,16,9,2021,16/09/2021,pecten_ala_p_cm,NA,blade,Blade Abundance – Alaria (ind/cm²),Pecten Blade Ab - Ala,3,2021-09-16_3
204,Pabay_16_9_21_3,3,Pabay,Saccharina,16/09/2021,16,9,2021,16/09/2021,scallop_brown_ala_p_cm,NA,blade,Blade Abundance – Alaria (ind/cm²),Scallop Blade Ab - Ala,3,2021-09-16_3
205,Pabay_16_9_21_3,3,Pabay,Saccharina,16/09/2021,16,9,2021,16/09/2021,bivalve_ala_p_cm,NA,blade,Blade Abundance – Alaria (ind/cm²),Bivalvia Blade Ab - Ala,3,2021-09-16_3
206,Pabay_16_9_21_3,3,Pabay,Alaria,16/09/2021,16,9,2021,16/09/2021,mytilus_ala_p_cm,NA,blade,Blade Abundance – Alaria (ind/cm²),Mytilus Blade Ab - Ala,3,2021-09-16_3
207,Pabay_16_9_21_3,3,Pabay,Alaria,16/09/2021,16,9,2021,16/09/2021,ostrea_ala_p_cm,NA,blade,Blade Abundance – Alaria (ind/cm²),Ostrea Blade Ab - Ala,3,2021-09-16_3
208,Pabay_16_9_21_3,3,Pabay,Alaria,16/09/2021,16,9,2021,16/09/2021,pecten_ala_p_cm,NA,blade,Blade Abundance – Alaria (ind/cm²),Pecten Blade Ab - Ala,3,2021-09-16_3
209,Pabay_16_9_21_3,3,Pabay,Alaria,16/09/2021,16,9,2021,16/09/2021,scallop_brown_ala_p_cm,NA,blade,Blade Abundance – Alaria (ind/cm²),Scallop Blade Ab - Ala,3,2021-09-16_3
210,Pabay_16_9_21_3,3,Pabay,Alaria,16/09/2021,16,9,2021,16/09/2021,bivalve_ala_p_cm,NA,blade,Blade Abundance – Alaria (ind/cm²),Bivalvia Blade Ab - Ala,3,2021-09-16_3
211,Pabay_21_12_21_1,1,Pabay,Alaria,21/12/2021,21,12,2021,21/12/2021,mytilus_ala_p_cm,NA,blade,Blade Abundance – Alaria (ind/cm²),Mytilus Blade Ab - Ala,1,2021-12-21_1
212,Pabay_21_12_21_1,1,Pabay,Alaria,21/12/2021,21,12,2021,21/12/2021,ostrea_ala_p_cm,NA,blade,Blade Abundance – Alaria (ind/cm²),Ostrea Blade Ab - Ala,1,2021-12-21_1
213,Pabay_21_12_21_1,1,Pabay,Alaria,21/12/2021,21,12,2021,21/12/2021,pecten_ala_p_cm,NA,blade,Blade Abundance – Alaria (ind/cm²),Pecten Blade Ab - Ala,1,2021-12-21_1
214,Pabay_21_12_21_1,1,Pabay,Alaria,21/12/2021,21,12,2021,21/12/2021,scallop_brown_ala_p_cm,NA,blade,Blade Abundance – Alaria (ind/cm²),Scallop Blade Ab - Ala,1,2021-12-21_1
215,Pabay_21_12_21_1,1,Pabay,Alaria,21/12/2021,21,12,2021,21/12/2021,bivalve_ala_p_cm,NA,blade,Blade Abundance – Alaria (ind/cm²),Bivalvia Blade Ab - Ala,1,2021-12-21_1
216,Pabay_21_12_21_1,1,Pabay,Saccharina,21/12/2021,21,12,2021,21/12/2021,mytilus_ala_p_cm,NA,blade,Blade Abundance – Alaria (ind/cm²),Mytilus Blade Ab - Ala,1,2021-12-21_1
217,Pabay_21_12_21_1,1,Pabay,Saccharina,21/12/2021,21,12,2021,21/12/2021,ostrea_ala_p_cm,NA,blade,Blade Abundance – Alaria (ind/cm²),Ostrea Blade Ab - Ala,1,2021-12-21_1
218,Pabay_21_12_21_1,1,Pabay,Saccharina,21/12/2021,21,12,2021,21/12/2021,pecten_ala_p_cm,NA,blade,Blade Abundance – Alaria (ind/cm²),Pecten Blade Ab - Ala,1,2021-12-21_1
219,Pabay_21_12_21_1,1,Pabay,Saccharina,21/12/2021,21,12,2021,21/12/2021,scallop_brown_ala_p_cm,NA,blade,Blade Abundance – Alaria (ind/cm²),Scallop Blade Ab - Ala,1,2021-12-21_1
220,Pabay_21_12_21_1,1,Pabay,Saccharina,21/12/2021,21,12,2021,21/12/2021,bivalve_ala_p_cm,NA,blade,Blade Abundance – Alaria (ind/cm²),Bivalvia Blade Ab - Ala,1,2021-12-21_1
221,Pabay_21_12_21_2,2,Pabay,Alaria,21/12/2021,21,12,2021,21/12/2021,mytilus_ala_p_cm,NA,blade,Blade Abundance – Alaria (ind/cm²),Mytilus Blade Ab - Ala,2,2021-12-21_2
222,Pabay_21_12_21_2,2,Pabay,Alaria,21/12/2021,21,12,2021,21/12/2021,ostrea_ala_p_cm,NA,blade,Blade Abundance – Alaria (ind/cm²),Ostrea Blade Ab - Ala,2,2021-12-21_2
223,Pabay_21_12_21_2,2,Pabay,Alaria,21/12/2021,21,12,2021,21/12/2021,pecten_ala_p_cm,NA,blade,Blade Abundance – Alaria (ind/cm²),Pecten Blade Ab - Ala,2,2021-12-21_2
224,Pabay_21_12_21_2,2,Pabay,Alaria,21/12/2021,21,12,2021,21/12/2021,scallop_brown_ala_p_cm,NA,blade,Blade Abundance – Alaria (ind/cm²),Scallop Blade Ab - Ala,2,2021-12-21_2
225,Pabay_21_12_21_2,2,Pabay,Alaria,21/12/2021,21,12,2021,21/12/2021,bivalve_ala_p_cm,NA,blade,Blade Abundance – Alaria (ind/cm²),Bivalvia Blade Ab - Ala,2,2021-12-21_2
226,Pabay_21_12_21_2,2,Pabay,Saccharina,21/12/2021,21,12,2021,21/12/2021,mytilus_ala_p_cm,NA,blade,Blade Abundance – Alaria (ind/cm²),Mytilus Blade Ab - Ala,2,2021-12-21_2
227,Pabay_21_12_21_2,2,Pabay,Saccharina,21/12/2021,21,12,2021,21/12/2021,ostrea_ala_p_cm,NA,blade,Blade Abundance – Alaria (ind/cm²),Ostrea Blade Ab - Ala,2,2021-12-21_2
228,Pabay_21_12_21_2,2,Pabay,Saccharina,21/12/2021,21,12,2021,21/12/2021,pecten_ala_p_cm,NA,blade,Blade Abundance – Alaria (ind/cm²),Pecten Blade Ab - Ala,2,2021-12-21_2
229,Pabay_21_12_21_2,2,Pabay,Saccharina,21/12/2021,21,12,2021,21/12/2021,scallop_brown_ala_p_cm,NA,blade,Blade Abundance – Alaria (ind/cm²),Scallop Blade Ab - Ala,2,2021-12-21_2
230,Pabay_21_12_21_2,2,Pabay,Saccharina,21/12/2021,21,12,2021,21/12/2021,bivalve_ala_p_cm,NA,blade,Blade Abundance – Alaria (ind/cm²),Bivalvia Blade Ab - Ala,2,2021-12-21_2
231,Pabay_21_12_21_3,3,Pabay,Alaria,21/12/2021,21,12,2021,21/12/2021,mytilus_ala_p_cm,NA,blade,Blade Abundance – Alaria (ind/cm²),Mytilus Blade Ab - Ala,3,2021-12-21_3
232,Pabay_21_12_21_3,3,Pabay,Alaria,21/12/2021,21,12,2021,21/12/2021,ostrea_ala_p_cm,NA,blade,Blade Abundance – Alaria (ind/cm²),Ostrea Blade Ab - Ala,3,2021-12-21_3
233,Pabay_21_12_21_3,3,Pabay,Alaria,21/12/2021,21,12,2021,21/12/2021,pecten_ala_p_cm,NA,blade,Blade Abundance – Alaria (ind/cm²),Pecten Blade Ab - Ala,3,2021-12-21_3
234,Pabay_21_12_21_3,3,Pabay,Alaria,21/12/2021,21,12,2021,21/12/2021,scallop_brown_ala_p_cm,NA,blade,Blade Abundance – Alaria (ind/cm²),Scallop Blade Ab - Ala,3,2021-12-21_3
235,Pabay_21_12_21_3,3,Pabay,Alaria,21/12/2021,21,12,2021,21/12/2021,bivalve_ala_p_cm,NA,blade,Blade Abundance – Alaria (ind/cm²),Bivalvia Blade Ab - Ala,3,2021-12-21_3
236,Pabay_21_12_21_3,3,Pabay,Saccharina,21/12/2021,21,12,2021,21/12/2021,mytilus_ala_p_cm,NA,blade,Blade Abundance – Alaria (ind/cm²),Mytilus Blade Ab - Ala,3,2021-12-21_3
237,Pabay_21_12_21_3,3,Pabay,Saccharina,21/12/2021,21,12,2021,21/12/2021,ostrea_ala_p_cm,NA,blade,Blade Abundance – Alaria (ind/cm²),Ostrea Blade Ab - Ala,3,2021-12-21_3
238,Pabay_21_12_21_3,3,Pabay,Saccharina,21/12/2021,21,12,2021,21/12/2021,pecten_ala_p_cm,NA,blade,Blade Abundance – Alaria (ind/cm²),Pecten Blade Ab - Ala,3,2021-12-21_3
239,Pabay_21_12_21_3,3,Pabay,Saccharina,21/12/2021,21,12,2021,21/12/2021,scallop_brown_ala_p_cm,NA,blade,Blade Abundance – Alaria (ind/cm²),Scallop Blade Ab - Ala,3,2021-12-21_3
240,Pabay_21_12_21_3,3,Pabay,Saccharina,21/12/2021,21,12,2021,21/12/2021,bivalve_ala_p_cm,NA,blade,Blade Abundance – Alaria (ind/cm²),Bivalvia Blade Ab - Ala,3,2021-12-21_3
246,Pabay_21_3_22_1,1,Pabay,Saccharina,21/03/2022,21,3,2022,21/03/2022,mytilus_ala_p_cm,NA,blade,Blade Abundance – Alaria (ind/cm²),Mytilus Blade Ab - Ala,1,2022-03-21_1
247,Pabay_21_3_22_1,1,Pabay,Saccharina,21/03/2022,21,3,2022,21/03/2022,ostrea_ala_p_cm,NA,blade,Blade Abundance – Alaria (ind/cm²),Ostrea Blade Ab - Ala,1,2022-03-21_1
248,Pabay_21_3_22_1,1,Pabay,Saccharina,21/03/2022,21,3,2022,21/03/2022,pecten_ala_p_cm,NA,blade,Blade Abundance – Alaria (ind/cm²),Pecten Blade Ab - Ala,1,2022-03-21_1
249,Pabay_21_3_22_1,1,Pabay,Saccharina,21/03/2022,21,3,2022,21/03/2022,scallop_brown_ala_p_cm,NA,blade,Blade Abundance – Alaria (ind/cm²),Scallop Blade Ab - Ala,1,2022-03-21_1
250,Pabay_21_3_22_1,1,Pabay,Saccharina,21/03/2022,21,3,2022,21/03/2022,bivalve_ala_p_cm,NA,blade,Blade Abundance – Alaria (ind/cm²),Bivalvia Blade Ab - Ala,1,2022-03-21_1
256,Pabay_21_3_22_2,2,Pabay,Saccharina,21/03/2022,21,3,2022,21/03/2022,mytilus_ala_p_cm,NA,blade,Blade Abundance – Alaria (ind/cm²),Mytilus Blade Ab - Ala,2,2022-03-21_2
257,Pabay_21_3_22_2,2,Pabay,Saccharina,21/03/2022,21,3,2022,21/03/2022,ostrea_ala_p_cm,NA,blade,Blade Abundance – Alaria (ind/cm²),Ostrea Blade Ab - Ala,2,2022-03-21_2
258,Pabay_21_3_22_2,2,Pabay,Saccharina,21/03/2022,21,3,2022,21/03/2022,pecten_ala_p_cm,NA,blade,Blade Abundance – Alaria (ind/cm²),Pecten Blade Ab - Ala,2,2022-03-21_2
259,Pabay_21_3_22_2,2,Pabay,Saccharina,21/03/2022,21,3,2022,21/03/2022,scallop_brown_ala_p_cm,NA,blade,Blade Abundance – Alaria (ind/cm²),Scallop Blade Ab - Ala,2,2022-03-21_2
260,Pabay_21_3_22_2,2,Pabay,Saccharina,21/03/2022,21,3,2022,21/03/2022,bivalve_ala_p_cm,NA,blade,Blade Abundance – Alaria (ind/cm²),Bivalvia Blade Ab - Ala,2,2022-03-21_2
266,Pabay_21_3_22_3,3,Pabay,Saccharina,21/03/2022,21,3,2022,21/03/2022,mytilus_ala_p_cm,NA,blade,Blade Abundance – Alaria (ind/cm²),Mytilus Blade Ab - Ala,3,2022-03-21_3
267,Pabay_21_3_22_3,3,Pabay,Saccharina,21/03/2022,21,3,2022,21/03/2022,ostrea_ala_p_cm,NA,blade,Blade Abundance – Alaria (ind/cm²),Ostrea Blade Ab - Ala,3,2022-03-21_3
268,Pabay_21_3_22_3,3,Pabay,Saccharina,21/03/2022,21,3,2022,21/03/2022,pecten_ala_p_cm,NA,blade,Blade Abundance – Alaria (ind/cm²),Pecten Blade Ab - Ala,3,2022-03-21_3
269,Pabay_21_3_22_3,3,Pabay,Saccharina,21/03/2022,21,3,2022,21/03/2022,scallop_brown_ala_p_cm,NA,blade,Blade Abundance – Alaria (ind/cm²),Scallop Blade Ab - Ala,3,2022-03-21_3
270,Pabay_21_3_22_3,3,Pabay,Saccharina,21/03/2022,21,3,2022,21/03/2022,bivalve_ala_p_cm,NA,blade,Blade Abundance – Alaria (ind/cm²),Bivalvia Blade Ab - Ala,3,2022-03-21_3
276,Pabay_22_5_22_1,1,Pabay,Saccharina,22/05/2022,22,5,2022,22/05/2022,mytilus_ala_p_cm,NA,blade,Blade Abundance – Alaria (ind/cm²),Mytilus Blade Ab - Ala,1,2022-05-22_1
277,Pabay_22_5_22_1,1,Pabay,Saccharina,22/05/2022,22,5,2022,22/05/2022,ostrea_ala_p_cm,NA,blade,Blade Abundance – Alaria (ind/cm²),Ostrea Blade Ab - Ala,1,2022-05-22_1
278,Pabay_22_5_22_1,1,Pabay,Saccharina,22/05/2022,22,5,2022,22/05/2022,pecten_ala_p_cm,NA,blade,Blade Abundance – Alaria (ind/cm²),Pecten Blade Ab - Ala,1,2022-05-22_1
279,Pabay_22_5_22_1,1,Pabay,Saccharina,22/05/2022,22,5,2022,22/05/2022,scallop_brown_ala_p_cm,NA,blade,Blade Abundance – Alaria (ind/cm²),Scallop Blade Ab - Ala,1,2022-05-22_1
280,Pabay_22_5_22_1,1,Pabay,Saccharina,22/05/2022,22,5,2022,22/05/2022,bivalve_ala_p_cm,NA,blade,Blade Abundance – Alaria (ind/cm²),Bivalvia Blade Ab - Ala,1,2022-05-22_1
286,Pabay_22_5_22_2,2,Pabay,Saccharina,22/05/2022,22,5,2022,22/05/2022,mytilus_ala_p_cm,NA,blade,Blade Abundance – Alaria (ind/cm²),Mytilus Blade Ab - Ala,2,2022-05-22_2
287,Pabay_22_5_22_2,2,Pabay,Saccharina,22/05/2022,22,5,2022,22/05/2022,ostrea_ala_p_cm,NA,blade,Blade Abundance – Alaria (ind/cm²),Ostrea Blade Ab - Ala,2,2022-05-22_2
288,Pabay_22_5_22_2,2,Pabay,Saccharina,22/05/2022,22,5,2022,22/05/2022,pecten_ala_p_cm,NA,blade,Blade Abundance – Alaria (ind/cm²),Pecten Blade Ab - Ala,2,2022-05-22_2
289,Pabay_22_5_22_2,2,Pabay,Saccharina,22/05/2022,22,5,2022,22/05/2022,scallop_brown_ala_p_cm,NA,blade,Blade Abundance – Alaria (ind/cm²),Scallop Blade Ab - Ala,2,2022-05-22_2
290,Pabay_22_5_22_2,2,Pabay,Saccharina,22/05/2022,22,5,2022,22/05/2022,bivalve_ala_p_cm,NA,blade,Blade Abundance – Alaria (ind/cm²),Bivalvia Blade Ab - Ala,2,2022-05-22_2
296,Pabay_22_5_22_3,3,Pabay,Saccharina,22/05/2022,22,5,2022,22/05/2022,mytilus_ala_p_cm,NA,blade,Blade Abundance – Alaria (ind/cm²),Mytilus Blade Ab - Ala,3,2022-05-22_3
297,Pabay_22_5_22_3,3,Pabay,Saccharina,22/05/2022,22,5,2022,22/05/2022,ostrea_ala_p_cm,NA,blade,Blade Abundance – Alaria (ind/cm²),Ostrea Blade Ab - Ala,3,2022-05-22_3
298,Pabay_22_5_22_3,3,Pabay,Saccharina,22/05/2022,22,5,2022,22/05/2022,pecten_ala_p_cm,NA,blade,Blade Abundance – Alaria (ind/cm²),Pecten Blade Ab - Ala,3,2022-05-22_3
299,Pabay_22_5_22_3,3,Pabay,Saccharina,22/05/2022,22,5,2022,22/05/2022,scallop_brown_ala_p_cm,NA,blade,Blade Abundance – Alaria (ind/cm²),Scallop Blade Ab - Ala,3,2022-05-22_3
300,Pabay_22_5_22_3,3,Pabay,Saccharina,22/05/2022,22,5,2022,22/05/2022,bivalve_ala_p_cm,NA,blade,Blade Abundance – Alaria (ind/cm²),Bivalvia Blade Ab - Ala,3,2022-05-22_3
306,Pabay_25_2_22_1,1,Pabay,Saccharina,25/02/2022,25,2,2022,25/02/2022,mytilus_ala_p_cm,NA,blade,Blade Abundance – Alaria (ind/cm²),Mytilus Blade Ab - Ala,1,2022-02-25_1
307,Pabay_25_2_22_1,1,Pabay,Saccharina,25/02/2022,25,2,2022,25/02/2022,ostrea_ala_p_cm,NA,blade,Blade Abundance – Alaria (ind/cm²),Ostrea Blade Ab - Ala,1,2022-02-25_1
308,Pabay_25_2_22_1,1,Pabay,Saccharina,25/02/2022,25,2,2022,25/02/2022,pecten_ala_p_cm,NA,blade,Blade Abundance – Alaria (ind/cm²),Pecten Blade Ab - Ala,1,2022-02-25_1
309,Pabay_25_2_22_1,1,Pabay,Saccharina,25/02/2022,25,2,2022,25/02/2022,scallop_brown_ala_p_cm,NA,blade,Blade Abundance – Alaria (ind/cm²),Scallop Blade Ab - Ala,1,2022-02-25_1
310,Pabay_25_2_22_1,1,Pabay,Saccharina,25/02/2022,25,2,2022,25/02/2022,bivalve_ala_p_cm,NA,blade,Blade Abundance – Alaria (ind/cm²),Bivalvia Blade Ab - Ala,1,2022-02-25_1
316,Pabay_25_2_22_2,2,Pabay,Saccharina,25/02/2022,25,2,2022,25/02/2022,mytilus_ala_p_cm,NA,blade,Blade Abundance – Alaria (ind/cm²),Mytilus Blade Ab - Ala,2,2022-02-25_2
317,Pabay_25_2_22_2,2,Pabay,Saccharina,25/02/2022,25,2,2022,25/02/2022,ostrea_ala_p_cm,NA,blade,Blade Abundance – Alaria (ind/cm²),Ostrea Blade Ab - Ala,2,2022-02-25_2
318,Pabay_25_2_22_2,2,Pabay,Saccharina,25/02/2022,25,2,2022,25/02/2022,pecten_ala_p_cm,NA,blade,Blade Abundance – Alaria (ind/cm²),Pecten Blade Ab - Ala,2,2022-02-25_2
319,Pabay_25_2_22_2,2,Pabay,Saccharina,25/02/2022,25,2,2022,25/02/2022,scallop_brown_ala_p_cm,NA,blade,Blade Abundance – Alaria (ind/cm²),Scallop Blade Ab - Ala,2,2022-02-25_2
320,Pabay_25_2_22_2,2,Pabay,Saccharina,25/02/2022,25,2,2022,25/02/2022,bivalve_ala_p_cm,NA,blade,Blade Abundance – Alaria (ind/cm²),Bivalvia Blade Ab - Ala,2,2022-02-25_2
326,Pabay_25_2_22_3,3,Pabay,Saccharina,25/02/2022,25,2,2022,25/02/2022,mytilus_ala_p_cm,NA,blade,Blade Abundance – Alaria (ind/cm²),Mytilus Blade Ab - Ala,3,2022-02-25_3
327,Pabay_25_2_22_3,3,Pabay,Saccharina,25/02/2022,25,2,2022,25/02/2022,ostrea_ala_p_cm,NA,blade,Blade Abundance – Alaria (ind/cm²),Ostrea Blade Ab - Ala,3,2022-02-25_3
328,Pabay_25_2_22_3,3,Pabay,Saccharina,25/02/2022,25,2,2022,25/02/2022,pecten_ala_p_cm,NA,blade,Blade Abundance – Alaria (ind/cm²),Pecten Blade Ab - Ala,3,2022-02-25_3
329,Pabay_25_2_22_3,3,Pabay,Saccharina,25/02/2022,25,2,2022,25/02/2022,scallop_brown_ala_p_cm,NA,blade,Blade Abundance – Alaria (ind/cm²),Scallop Blade Ab - Ala,3,2022-02-25_3
330,Pabay_25_2_22_3,3,Pabay,Saccharina,25/02/2022,25,2,2022,25/02/2022,bivalve_ala_p_cm,NA,blade,Blade Abundance – Alaria (ind/cm²),Bivalvia Blade Ab - Ala,3,2022-02-25_3
331,Pabay_29_11_21_1,1,Pabay,Saccharina,29/11/2021,29,11,2021,29/11/2021,mytilus_ala_p_cm,NA,blade,Blade Abundance – Alaria (ind/cm²),Mytilus Blade Ab - Ala,1,2021-11-29_1
332,Pabay_29_11_21_1,1,Pabay,Saccharina,29/11/2021,29,11,2021,29/11/2021,ostrea_ala_p_cm,NA,blade,Blade Abundance – Alaria (ind/cm²),Ostrea Blade Ab - Ala,1,2021-11-29_1
333,Pabay_29_11_21_1,1,Pabay,Saccharina,29/11/2021,29,11,2021,29/11/2021,pecten_ala_p_cm,NA,blade,Blade Abundance – Alaria (ind/cm²),Pecten Blade Ab - Ala,1,2021-11-29_1
334,Pabay_29_11_21_1,1,Pabay,Saccharina,29/11/2021,29,11,2021,29/11/2021,scallop_brown_ala_p_cm,NA,blade,Blade Abundance – Alaria (ind/cm²),Scallop Blade Ab - Ala,1,2021-11-29_1
335,Pabay_29_11_21_1,1,Pabay,Saccharina,29/11/2021,29,11,2021,29/11/2021,bivalve_ala_p_cm,NA,blade,Blade Abundance – Alaria (ind/cm²),Bivalvia Blade Ab - Ala,1,2021-11-29_1
336,Pabay_29_11_21_1,1,Pabay,Alaria,29/11/2021,29,11,2021,29/11/2021,mytilus_ala_p_cm,NA,blade,Blade Abundance – Alaria (ind/cm²),Mytilus Blade Ab - Ala,1,2021-11-29_1
337,Pabay_29_11_21_1,1,Pabay,Alaria,29/11/2021,29,11,2021,29/11/2021,ostrea_ala_p_cm,NA,blade,Blade Abundance – Alaria (ind/cm²),Ostrea Blade Ab - Ala,1,2021-11-29_1
338,Pabay_29_11_21_1,1,Pabay,Alaria,29/11/2021,29,11,2021,29/11/2021,pecten_ala_p_cm,NA,blade,Blade Abundance – Alaria (ind/cm²),Pecten Blade Ab - Ala,1,2021-11-29_1
339,Pabay_29_11_21_1,1,Pabay,Alaria,29/11/2021,29,11,2021,29/11/2021,scallop_brown_ala_p_cm,NA,blade,Blade Abundance – Alaria (ind/cm²),Scallop Blade Ab - Ala,1,2021-11-29_1
340,Pabay_29_11_21_1,1,Pabay,Alaria,29/11/2021,29,11,2021,29/11/2021,bivalve_ala_p_cm,NA,blade,Blade Abundance – Alaria (ind/cm²),Bivalvia Blade Ab - Ala,1,2021-11-29_1
341,Pabay_29_11_21_2,2,Pabay,Saccharina,29/11/2021,29,11,2021,29/11/2021,mytilus_ala_p_cm,NA,blade,Blade Abundance – Alaria (ind/cm²),Mytilus Blade Ab - Ala,2,2021-11-29_2
342,Pabay_29_11_21_2,2,Pabay,Saccharina,29/11/2021,29,11,2021,29/11/2021,ostrea_ala_p_cm,NA,blade,Blade Abundance – Alaria (ind/cm²),Ostrea Blade Ab - Ala,2,2021-11-29_2
343,Pabay_29_11_21_2,2,Pabay,Saccharina,29/11/2021,29,11,2021,29/11/2021,pecten_ala_p_cm,NA,blade,Blade Abundance – Alaria (ind/cm²),Pecten Blade Ab - Ala,2,2021-11-29_2
344,Pabay_29_11_21_2,2,Pabay,Saccharina,29/11/2021,29,11,2021,29/11/2021,scallop_brown_ala_p_cm,NA,blade,Blade Abundance – Alaria (ind/cm²),Scallop Blade Ab - Ala,2,2021-11-29_2
345,Pabay_29_11_21_2,2,Pabay,Saccharina,29/11/2021,29,11,2021,29/11/2021,bivalve_ala_p_cm,NA,blade,Blade Abundance – Alaria (ind/cm²),Bivalvia Blade Ab - Ala,2,2021-11-29_2
346,Pabay_29_11_21_2,2,Pabay,Alaria,29/11/2021,29,11,2021,29/11/2021,mytilus_ala_p_cm,NA,blade,Blade Abundance – Alaria (ind/cm²),Mytilus Blade Ab - Ala,2,2021-11-29_2
347,Pabay_29_11_21_2,2,Pabay,Alaria,29/11/2021,29,11,2021,29/11/2021,ostrea_ala_p_cm,NA,blade,Blade Abundance – Alaria (ind/cm²),Ostrea Blade Ab - Ala,2,2021-11-29_2
348,Pabay_29_11_21_2,2,Pabay,Alaria,29/11/2021,29,11,2021,29/11/2021,pecten_ala_p_cm,NA,blade,Blade Abundance – Alaria (ind/cm²),Pecten Blade Ab - Ala,2,2021-11-29_2
349,Pabay_29_11_21_2,2,Pabay,Alaria,29/11/2021,29,11,2021,29/11/2021,scallop_brown_ala_p_cm,NA,blade,Blade Abundance – Alaria (ind/cm²),Scallop Blade Ab - Ala,2,2021-11-29_2
350,Pabay_29_11_21_2,2,Pabay,Alaria,29/11/2021,29,11,2021,29/11/2021,bivalve_ala_p_cm,NA,blade,Blade Abundance – Alaria (ind/cm²),Bivalvia Blade Ab - Ala,2,2021-11-29_2
351,Pabay_29_11_21_3,3,Pabay,Saccharina,29/11/2021,29,11,2021,29/11/2021,mytilus_ala_p_cm,NA,blade,Blade Abundance – Alaria (ind/cm²),Mytilus Blade Ab - Ala,3,2021-11-29_3
352,Pabay_29_11_21_3,3,Pabay,Saccharina,29/11/2021,29,11,2021,29/11/2021,ostrea_ala_p_cm,NA,blade,Blade Abundance – Alaria (ind/cm²),Ostrea Blade Ab - Ala,3,2021-11-29_3
353,Pabay_29_11_21_3,3,Pabay,Saccharina,29/11/2021,29,11,2021,29/11/2021,pecten_ala_p_cm,NA,blade,Blade Abundance – Alaria (ind/cm²),Pecten Blade Ab - Ala,3,2021-11-29_3
354,Pabay_29_11_21_3,3,Pabay,Saccharina,29/11/2021,29,11,2021,29/11/2021,scallop_brown_ala_p_cm,NA,blade,Blade Abundance – Alaria (ind/cm²),Scallop Blade Ab - Ala,3,2021-11-29_3
355,Pabay_29_11_21_3,3,Pabay,Saccharina,29/11/2021,29,11,2021,29/11/2021,bivalve_ala_p_cm,NA,blade,Blade Abundance – Alaria (ind/cm²),Bivalvia Blade Ab - Ala,3,2021-11-29_3
356,Pabay_29_11_21_3,3,Pabay,Alaria,29/11/2021,29,11,2021,29/11/2021,mytilus_ala_p_cm,NA,blade,Blade Abundance – Alaria (ind/cm²),Mytilus Blade Ab - Ala,3,2021-11-29_3
357,Pabay_29_11_21_3,3,Pabay,Alaria,29/11/2021,29,11,2021,29/11/2021,ostrea_ala_p_cm,NA,blade,Blade Abundance – Alaria (ind/cm²),Ostrea Blade Ab - Ala,3,2021-11-29_3
358,Pabay_29_11_21_3,3,Pabay,Alaria,29/11/2021,29,11,2021,29/11/2021,pecten_ala_p_cm,NA,blade,Blade Abundance – Alaria (ind/cm²),Pecten Blade Ab - Ala,3,2021-11-29_3
359,Pabay_29_11_21_3,3,Pabay,Alaria,29/11/2021,29,11,2021,29/11/2021,scallop_brown_ala_p_cm,NA,blade,Blade Abundance – Alaria (ind/cm²),Scallop Blade Ab - Ala,3,2021-11-29_3
360,Pabay_29_11_21_3,3,Pabay,Alaria,29/11/2021,29,11,2021,29/11/2021,bivalve_ala_p_cm,NA,blade,Blade Abundance – Alaria (ind/cm²),Bivalvia Blade Ab - Ala,3,2021-11-29_3
366,Pabay_30_1_22_1,1,Pabay,Alaria,30/01/2022,30,1,2022,30/01/2022,mytilus_ala_p_cm,NA,blade,Blade Abundance – Alaria (ind/cm²),Mytilus Blade Ab - Ala,1,2022-01-30_1
367,Pabay_30_1_22_1,1,Pabay,Alaria,30/01/2022,30,1,2022,30/01/2022,ostrea_ala_p_cm,NA,blade,Blade Abundance – Alaria (ind/cm²),Ostrea Blade Ab - Ala,1,2022-01-30_1
368,Pabay_30_1_22_1,1,Pabay,Alaria,30/01/2022,30,1,2022,30/01/2022,pecten_ala_p_cm,NA,blade,Blade Abundance – Alaria (ind/cm²),Pecten Blade Ab - Ala,1,2022-01-30_1
369,Pabay_30_1_22_1,1,Pabay,Alaria,30/01/2022,30,1,2022,30/01/2022,scallop_brown_ala_p_cm,NA,blade,Blade Abundance – Alaria (ind/cm²),Scallop Blade Ab - Ala,1,2022-01-30_1
370,Pabay_30_1_22_1,1,Pabay,Alaria,30/01/2022,30,1,2022,30/01/2022,bivalve_ala_p_cm,NA,blade,Blade Abundance – Alaria (ind/cm²),Bivalvia Blade Ab - Ala,1,2022-01-30_1
376,Pabay_30_1_22_2,2,Pabay,Alaria,30/01/2022,30,1,2022,30/01/2022,mytilus_ala_p_cm,NA,blade,Blade Abundance – Alaria (ind/cm²),Mytilus Blade Ab - Ala,2,2022-01-30_2
377,Pabay_30_1_22_2,2,Pabay,Alaria,30/01/2022,30,1,2022,30/01/2022,ostrea_ala_p_cm,NA,blade,Blade Abundance – Alaria (ind/cm²),Ostrea Blade Ab - Ala,2,2022-01-30_2
378,Pabay_30_1_22_2,2,Pabay,Alaria,30/01/2022,30,1,2022,30/01/2022,pecten_ala_p_cm,NA,blade,Blade Abundance – Alaria (ind/cm²),Pecten Blade Ab - Ala,2,2022-01-30_2
379,Pabay_30_1_22_2,2,Pabay,Alaria,30/01/2022,30,1,2022,30/01/2022,scallop_brown_ala_p_cm,NA,blade,Blade Abundance – Alaria (ind/cm²),Scallop Blade Ab - Ala,2,2022-01-30_2
380,Pabay_30_1_22_2,2,Pabay,Alaria,30/01/2022,30,1,2022,30/01/2022,bivalve_ala_p_cm,NA,blade,Blade Abundance – Alaria (ind/cm²),Bivalvia Blade Ab - Ala,2,2022-01-30_2
386,Pabay_30_1_22_3,3,Pabay,Alaria,30/01/2022,30,1,2022,30/01/2022,mytilus_ala_p_cm,NA,blade,Blade Abundance – Alaria (ind/cm²),Mytilus Blade Ab - Ala,3,2022-01-30_3
387,Pabay_30_1_22_3,3,Pabay,Alaria,30/01/2022,30,1,2022,30/01/2022,ostrea_ala_p_cm,NA,blade,Blade Abundance – Alaria (ind/cm²),Ostrea Blade Ab - Ala,3,2022-01-30_3
388,Pabay_30_1_22_3,3,Pabay,Alaria,30/01/2022,30,1,2022,30/01/2022,pecten_ala_p_cm,NA,blade,Blade Abundance – Alaria (ind/cm²),Pecten Blade Ab - Ala,3,2022-01-30_3
389,Pabay_30_1_22_3,3,Pabay,Alaria,30/01/2022,30,1,2022,30/01/2022,scallop_brown_ala_p_cm,NA,blade,Blade Abundance – Alaria (ind/cm²),Scallop Blade Ab - Ala,3,2022-01-30_3
390,Pabay_30_1_22_3,3,Pabay,Alaria,30/01/2022,30,1,2022,30/01/2022,bivalve_ala_p_cm,NA,blade,Blade Abundance – Alaria (ind/cm²),Bivalvia Blade Ab - Ala,3,2022-01-30_3
391,Pabay_30_10_21_1,1,Pabay,Saccharina,30/10/2021,30,10,2021,30/10/2021,mytilus_ala_p_cm,NA,blade,Blade Abundance – Alaria (ind/cm²),Mytilus Blade Ab - Ala,1,2021-10-30_1
392,Pabay_30_10_21_1,1,Pabay,Saccharina,30/10/2021,30,10,2021,30/10/2021,ostrea_ala_p_cm,NA,blade,Blade Abundance – Alaria (ind/cm²),Ostrea Blade Ab - Ala,1,2021-10-30_1
393,Pabay_30_10_21_1,1,Pabay,Saccharina,30/10/2021,30,10,2021,30/10/2021,pecten_ala_p_cm,NA,blade,Blade Abundance – Alaria (ind/cm²),Pecten Blade Ab - Ala,1,2021-10-30_1
394,Pabay_30_10_21_1,1,Pabay,Saccharina,30/10/2021,30,10,2021,30/10/2021,scallop_brown_ala_p_cm,NA,blade,Blade Abundance – Alaria (ind/cm²),Scallop Blade Ab - Ala,1,2021-10-30_1
395,Pabay_30_10_21_1,1,Pabay,Saccharina,30/10/2021,30,10,2021,30/10/2021,bivalve_ala_p_cm,NA,blade,Blade Abundance – Alaria (ind/cm²),Bivalvia Blade Ab - Ala,1,2021-10-30_1
396,Pabay_30_10_21_1,1,Pabay,Alaria,30/10/2021,30,10,2021,30/10/2021,mytilus_ala_p_cm,NA,blade,Blade Abundance – Alaria (ind/cm²),Mytilus Blade Ab - Ala,1,2021-10-30_1
397,Pabay_30_10_21_1,1,Pabay,Alaria,30/10/2021,30,10,2021,30/10/2021,ostrea_ala_p_cm,NA,blade,Blade Abundance – Alaria (ind/cm²),Ostrea Blade Ab - Ala,1,2021-10-30_1
398,Pabay_30_10_21_1,1,Pabay,Alaria,30/10/2021,30,10,2021,30/10/2021,pecten_ala_p_cm,NA,blade,Blade Abundance – Alaria (ind/cm²),Pecten Blade Ab - Ala,1,2021-10-30_1
399,Pabay_30_10_21_1,1,Pabay,Alaria,30/10/2021,30,10,2021,30/10/2021,scallop_brown_ala_p_cm,NA,blade,Blade Abundance – Alaria (ind/cm²),Scallop Blade Ab - Ala,1,2021-10-30_1
400,Pabay_30_10_21_1,1,Pabay,Alaria,30/10/2021,30,10,2021,30/10/2021,bivalve_ala_p_cm,NA,blade,Blade Abundance – Alaria (ind/cm²),Bivalvia Blade Ab - Ala,1,2021-10-30_1
401,Pabay_30_10_21_2,2,Pabay,Saccharina,30/10/2021,30,10,2021,30/10/2021,mytilus_ala_p_cm,NA,blade,Blade Abundance – Alaria (ind/cm²),Mytilus Blade Ab - Ala,2,2021-10-30_2
402,Pabay_30_10_21_2,2,Pabay,Saccharina,30/10/2021,30,10,2021,30/10/2021,ostrea_ala_p_cm,NA,blade,Blade Abundance – Alaria (ind/cm²),Ostrea Blade Ab - Ala,2,2021-10-30_2
403,Pabay_30_10_21_2,2,Pabay,Saccharina,30/10/2021,30,10,2021,30/10/2021,pecten_ala_p_cm,NA,blade,Blade Abundance – Alaria (ind/cm²),Pecten Blade Ab - Ala,2,2021-10-30_2
404,Pabay_30_10_21_2,2,Pabay,Saccharina,30/10/2021,30,10,2021,30/10/2021,scallop_brown_ala_p_cm,NA,blade,Blade Abundance – Alaria (ind/cm²),Scallop Blade Ab - Ala,2,2021-10-30_2
405,Pabay_30_10_21_2,2,Pabay,Saccharina,30/10/2021,30,10,2021,30/10/2021,bivalve_ala_p_cm,NA,blade,Blade Abundance – Alaria (ind/cm²),Bivalvia Blade Ab - Ala,2,2021-10-30_2
406,Pabay_30_10_21_2,2,Pabay,Alaria,30/10/2021,30,10,2021,30/10/2021,mytilus_ala_p_cm,NA,blade,Blade Abundance – Alaria (ind/cm²),Mytilus Blade Ab - Ala,2,2021-10-30_2
407,Pabay_30_10_21_2,2,Pabay,Alaria,30/10/2021,30,10,2021,30/10/2021,ostrea_ala_p_cm,NA,blade,Blade Abundance – Alaria (ind/cm²),Ostrea Blade Ab - Ala,2,2021-10-30_2
408,Pabay_30_10_21_2,2,Pabay,Alaria,30/10/2021,30,10,2021,30/10/2021,pecten_ala_p_cm,NA,blade,Blade Abundance – Alaria (ind/cm²),Pecten Blade Ab - Ala,2,2021-10-30_2
409,Pabay_30_10_21_2,2,Pabay,Alaria,30/10/2021,30,10,2021,30/10/2021,scallop_brown_ala_p_cm,NA,blade,Blade Abundance – Alaria (ind/cm²),Scallop Blade Ab - Ala,2,2021-10-30_2
410,Pabay_30_10_21_2,2,Pabay,Alaria,30/10/2021,30,10,2021,30/10/2021,bivalve_ala_p_cm,NA,blade,Blade Abundance – Alaria (ind/cm²),Bivalvia Blade Ab - Ala,2,2021-10-30_2
411,Pabay_30_10_21_3,3,Pabay,Saccharina,30/10/2021,30,10,2021,30/10/2021,mytilus_ala_p_cm,NA,blade,Blade Abundance – Alaria (ind/cm²),Mytilus Blade Ab - Ala,3,2021-10-30_3
412,Pabay_30_10_21_3,3,Pabay,Saccharina,30/10/2021,30,10,2021,30/10/2021,ostrea_ala_p_cm,NA,blade,Blade Abundance – Alaria (ind/cm²),Ostrea Blade Ab - Ala,3,2021-10-30_3
413,Pabay_30_10_21_3,3,Pabay,Saccharina,30/10/2021,30,10,2021,30/10/2021,pecten_ala_p_cm,NA,blade,Blade Abundance – Alaria (ind/cm²),Pecten Blade Ab - Ala,3,2021-10-30_3
414,Pabay_30_10_21_3,3,Pabay,Saccharina,30/10/2021,30,10,2021,30/10/2021,scallop_brown_ala_p_cm,NA,blade,Blade Abundance – Alaria (ind/cm²),Scallop Blade Ab - Ala,3,2021-10-30_3
415,Pabay_30_10_21_3,3,Pabay,Saccharina,30/10/2021,30,10,2021,30/10/2021,bivalve_ala_p_cm,NA,blade,Blade Abundance – Alaria (ind/cm²),Bivalvia Blade Ab - Ala,3,2021-10-30_3
416,Pabay_30_10_21_3,3,Pabay,Alaria,30/10/2021,30,10,2021,30/10/2021,mytilus_ala_p_cm,NA,blade,Blade Abundance – Alaria (ind/cm²),Mytilus Blade Ab - Ala,3,2021-10-30_3
417,Pabay_30_10_21_3,3,Pabay,Alaria,30/10/2021,30,10,2021,30/10/2021,ostrea_ala_p_cm,NA,blade,Blade Abundance – Alaria (ind/cm²),Ostrea Blade Ab - Ala,3,2021-10-30_3
418,Pabay_30_10_21_3,3,Pabay,Alaria,30/10/2021,30,10,2021,30/10/2021,pecten_ala_p_cm,NA,blade,Blade Abundance – Alaria (ind/cm²),Pecten Blade Ab - Ala,3,2021-10-30_3
419,Pabay_30_10_21_3,3,Pabay,Alaria,30/10/2021,30,10,2021,30/10/2021,scallop_brown_ala_p_cm,NA,blade,Blade Abundance – Alaria (ind/cm²),Scallop Blade Ab - Ala,3,2021-10-30_3
420,Pabay_30_10_21_3,3,Pabay,Alaria,30/10/2021,30,10,2021,30/10/2021,bivalve_ala_p_cm,NA,blade,Blade Abundance – Alaria (ind/cm²),Bivalvia Blade Ab - Ala,3,2021-10-30_3
421,Pabay_30_6_22_1,1,Pabay,Alaria,30/06/2022,30,6,2022,30/06/2022,mytilus_ala_p_cm,NA,blade,Blade Abundance – Alaria (ind/cm²),Mytilus Blade Ab - Ala,1,2022-06-30_1
422,Pabay_30_6_22_1,1,Pabay,Alaria,30/06/2022,30,6,2022,30/06/2022,ostrea_ala_p_cm,NA,blade,Blade Abundance – Alaria (ind/cm²),Ostrea Blade Ab - Ala,1,2022-06-30_1
423,Pabay_30_6_22_1,1,Pabay,Alaria,30/06/2022,30,6,2022,30/06/2022,pecten_ala_p_cm,NA,blade,Blade Abundance – Alaria (ind/cm²),Pecten Blade Ab - Ala,1,2022-06-30_1
424,Pabay_30_6_22_1,1,Pabay,Alaria,30/06/2022,30,6,2022,30/06/2022,scallop_brown_ala_p_cm,NA,blade,Blade Abundance – Alaria (ind/cm²),Scallop Blade Ab - Ala,1,2022-06-30_1
425,Pabay_30_6_22_1,1,Pabay,Alaria,30/06/2022,30,6,2022,30/06/2022,bivalve_ala_p_cm,NA,blade,Blade Abundance – Alaria (ind/cm²),Bivalvia Blade Ab - Ala,1,2022-06-30_1
426,Pabay_30_6_22_1,1,Pabay,Saccharina,30/06/2022,30,6,2022,30/06/2022,mytilus_ala_p_cm,NA,blade,Blade Abundance – Alaria (ind/cm²),Mytilus Blade Ab - Ala,1,2022-06-30_1
427,Pabay_30_6_22_1,1,Pabay,Saccharina,30/06/2022,30,6,2022,30/06/2022,ostrea_ala_p_cm,NA,blade,Blade Abundance – Alaria (ind/cm²),Ostrea Blade Ab - Ala,1,2022-06-30_1
428,Pabay_30_6_22_1,1,Pabay,Saccharina,30/06/2022,30,6,2022,30/06/2022,pecten_ala_p_cm,NA,blade,Blade Abundance – Alaria (ind/cm²),Pecten Blade Ab - Ala,1,2022-06-30_1
429,Pabay_30_6_22_1,1,Pabay,Saccharina,30/06/2022,30,6,2022,30/06/2022,scallop_brown_ala_p_cm,NA,blade,Blade Abundance – Alaria (ind/cm²),Scallop Blade Ab - Ala,1,2022-06-30_1
430,Pabay_30_6_22_1,1,Pabay,Saccharina,30/06/2022,30,6,2022,30/06/2022,bivalve_ala_p_cm,NA,blade,Blade Abundance – Alaria (ind/cm²),Bivalvia Blade Ab - Ala,1,2022-06-30_1
431,Pabay_30_6_22_2,2,Pabay,Alaria,30/06/2022,30,6,2022,30/06/2022,mytilus_ala_p_cm,NA,blade,Blade Abundance – Alaria (ind/cm²),Mytilus Blade Ab - Ala,2,2022-06-30_2
432,Pabay_30_6_22_2,2,Pabay,Alaria,30/06/2022,30,6,2022,30/06/2022,ostrea_ala_p_cm,NA,blade,Blade Abundance – Alaria (ind/cm²),Ostrea Blade Ab - Ala,2,2022-06-30_2
433,Pabay_30_6_22_2,2,Pabay,Alaria,30/06/2022,30,6,2022,30/06/2022,pecten_ala_p_cm,NA,blade,Blade Abundance – Alaria (ind/cm²),Pecten Blade Ab - Ala,2,2022-06-30_2
434,Pabay_30_6_22_2,2,Pabay,Alaria,30/06/2022,30,6,2022,30/06/2022,scallop_brown_ala_p_cm,NA,blade,Blade Abundance – Alaria (ind/cm²),Scallop Blade Ab - Ala,2,2022-06-30_2
435,Pabay_30_6_22_2,2,Pabay,Alaria,30/06/2022,30,6,2022,30/06/2022,bivalve_ala_p_cm,NA,blade,Blade Abundance – Alaria (ind/cm²),Bivalvia Blade Ab - Ala,2,2022-06-30_2
436,Pabay_30_6_22_2,2,Pabay,Saccharina,30/06/2022,30,6,2022,30/06/2022,mytilus_ala_p_cm,NA,blade,Blade Abundance – Alaria (ind/cm²),Mytilus Blade Ab - Ala,2,2022-06-30_2
437,Pabay_30_6_22_2,2,Pabay,Saccharina,30/06/2022,30,6,2022,30/06/2022,ostrea_ala_p_cm,NA,blade,Blade Abundance – Alaria (ind/cm²),Ostrea Blade Ab - Ala,2,2022-06-30_2
438,Pabay_30_6_22_2,2,Pabay,Saccharina,30/06/2022,30,6,2022,30/06/2022,pecten_ala_p_cm,NA,blade,Blade Abundance – Alaria (ind/cm²),Pecten Blade Ab - Ala,2,2022-06-30_2
439,Pabay_30_6_22_2,2,Pabay,Saccharina,30/06/2022,30,6,2022,30/06/2022,scallop_brown_ala_p_cm,NA,blade,Blade Abundance – Alaria (ind/cm²),Scallop Blade Ab - Ala,2,2022-06-30_2
440,Pabay_30_6_22_2,2,Pabay,Saccharina,30/06/2022,30,6,2022,30/06/2022,bivalve_ala_p_cm,NA,blade,Blade Abundance – Alaria (ind/cm²),Bivalvia Blade Ab - Ala,2,2022-06-30_2
441,Pabay_30_6_22_3,3,Pabay,Alaria,30/06/2022,30,6,2022,30/06/2022,mytilus_ala_p_cm,NA,blade,Blade Abundance – Alaria (ind/cm²),Mytilus Blade Ab - Ala,3,2022-06-30_3
442,Pabay_30_6_22_3,3,Pabay,Alaria,30/06/2022,30,6,2022,30/06/2022,ostrea_ala_p_cm,NA,blade,Blade Abundance – Alaria (ind/cm²),Ostrea Blade Ab - Ala,3,2022-06-30_3
443,Pabay_30_6_22_3,3,Pabay,Alaria,30/06/2022,30,6,2022,30/06/2022,pecten_ala_p_cm,NA,blade,Blade Abundance – Alaria (ind/cm²),Pecten Blade Ab - Ala,3,2022-06-30_3
444,Pabay_30_6_22_3,3,Pabay,Alaria,30/06/2022,30,6,2022,30/06/2022,scallop_brown_ala_p_cm,NA,blade,Blade Abundance – Alaria (ind/cm²),Scallop Blade Ab - Ala,3,2022-06-30_3
445,Pabay_30_6_22_3,3,Pabay,Alaria,30/06/2022,30,6,2022,30/06/2022,bivalve_ala_p_cm,NA,blade,Blade Abundance – Alaria (ind/cm²),Bivalvia Blade Ab - Ala,3,2022-06-30_3
446,Pabay_30_6_22_3,3,Pabay,Saccharina,30/06/2022,30,6,2022,30/06/2022,mytilus_ala_p_cm,NA,blade,Blade Abundance – Alaria (ind/cm²),Mytilus Blade Ab - Ala,3,2022-06-30_3
447,Pabay_30_6_22_3,3,Pabay,Saccharina,30/06/2022,30,6,2022,30/06/2022,ostrea_ala_p_cm,NA,blade,Blade Abundance – Alaria (ind/cm²),Ostrea Blade Ab - Ala,3,2022-06-30_3
448,Pabay_30_6_22_3,3,Pabay,Saccharina,30/06/2022,30,6,2022,30/06/2022,pecten_ala_p_cm,NA,blade,Blade Abundance – Alaria (ind/cm²),Pecten Blade Ab - Ala,3,2022-06-30_3
449,Pabay_30_6_22_3,3,Pabay,Saccharina,30/06/2022,30,6,2022,30/06/2022,scallop_brown_ala_p_cm,NA,blade,Blade Abundance – Alaria (ind/cm²),Scallop Blade Ab - Ala,3,2022-06-30_3
450,Pabay_30_6_22_3,3,Pabay,Saccharina,30/06/2022,30,6,2022,30/06/2022,bivalve_ala_p_cm,NA,blade,Blade Abundance – Alaria (ind/cm²),Bivalvia Blade Ab - Ala,3,2022-06-30_3
451,Pabay_30_7_22_1,1,Pabay,Alaria,30/07/2022,30,7,2022,30/07/2022,mytilus_ala_p_cm,NA,blade,Blade Abundance – Alaria (ind/cm²),Mytilus Blade Ab - Ala,1,2022-07-30_1
452,Pabay_30_7_22_1,1,Pabay,Alaria,30/07/2022,30,7,2022,30/07/2022,ostrea_ala_p_cm,NA,blade,Blade Abundance – Alaria (ind/cm²),Ostrea Blade Ab - Ala,1,2022-07-30_1
453,Pabay_30_7_22_1,1,Pabay,Alaria,30/07/2022,30,7,2022,30/07/2022,pecten_ala_p_cm,NA,blade,Blade Abundance – Alaria (ind/cm²),Pecten Blade Ab - Ala,1,2022-07-30_1
454,Pabay_30_7_22_1,1,Pabay,Alaria,30/07/2022,30,7,2022,30/07/2022,scallop_brown_ala_p_cm,NA,blade,Blade Abundance – Alaria (ind/cm²),Scallop Blade Ab - Ala,1,2022-07-30_1
455,Pabay_30_7_22_1,1,Pabay,Alaria,30/07/2022,30,7,2022,30/07/2022,bivalve_ala_p_cm,NA,blade,Blade Abundance – Alaria (ind/cm²),Bivalvia Blade Ab - Ala,1,2022-07-30_1
456,Pabay_30_7_22_1,1,Pabay,Saccharina,30/07/2022,30,7,2022,30/07/2022,mytilus_ala_p_cm,NA,blade,Blade Abundance – Alaria (ind/cm²),Mytilus Blade Ab - Ala,1,2022-07-30_1
457,Pabay_30_7_22_1,1,Pabay,Saccharina,30/07/2022,30,7,2022,30/07/2022,ostrea_ala_p_cm,NA,blade,Blade Abundance – Alaria (ind/cm²),Ostrea Blade Ab - Ala,1,2022-07-30_1
458,Pabay_30_7_22_1,1,Pabay,Saccharina,30/07/2022,30,7,2022,30/07/2022,pecten_ala_p_cm,NA,blade,Blade Abundance – Alaria (ind/cm²),Pecten Blade Ab - Ala,1,2022-07-30_1
459,Pabay_30_7_22_1,1,Pabay,Saccharina,30/07/2022,30,7,2022,30/07/2022,scallop_brown_ala_p_cm,NA,blade,Blade Abundance – Alaria (ind/cm²),Scallop Blade Ab - Ala,1,2022-07-30_1
460,Pabay_30_7_22_1,1,Pabay,Saccharina,30/07/2022,30,7,2022,30/07/2022,bivalve_ala_p_cm,NA,blade,Blade Abundance – Alaria (ind/cm²),Bivalvia Blade Ab - Ala,1,2022-07-30_1
461,Pabay_30_7_22_2,2,Pabay,Alaria,30/07/2022,30,7,2022,30/07/2022,mytilus_ala_p_cm,NA,blade,Blade Abundance – Alaria (ind/cm²),Mytilus Blade Ab - Ala,2,2022-07-30_2
462,Pabay_30_7_22_2,2,Pabay,Alaria,30/07/2022,30,7,2022,30/07/2022,ostrea_ala_p_cm,NA,blade,Blade Abundance – Alaria (ind/cm²),Ostrea Blade Ab - Ala,2,2022-07-30_2
463,Pabay_30_7_22_2,2,Pabay,Alaria,30/07/2022,30,7,2022,30/07/2022,pecten_ala_p_cm,NA,blade,Blade Abundance – Alaria (ind/cm²),Pecten Blade Ab - Ala,2,2022-07-30_2
464,Pabay_30_7_22_2,2,Pabay,Alaria,30/07/2022,30,7,2022,30/07/2022,scallop_brown_ala_p_cm,NA,blade,Blade Abundance – Alaria (ind/cm²),Scallop Blade Ab - Ala,2,2022-07-30_2
465,Pabay_30_7_22_2,2,Pabay,Alaria,30/07/2022,30,7,2022,30/07/2022,bivalve_ala_p_cm,NA,blade,Blade Abundance – Alaria (ind/cm²),Bivalvia Blade Ab - Ala,2,2022-07-30_2
466,Pabay_30_7_22_2,2,Pabay,Saccharina,30/07/2022,30,7,2022,30/07/2022,mytilus_ala_p_cm,NA,blade,Blade Abundance – Alaria (ind/cm²),Mytilus Blade Ab - Ala,2,2022-07-30_2
467,Pabay_30_7_22_2,2,Pabay,Saccharina,30/07/2022,30,7,2022,30/07/2022,ostrea_ala_p_cm,NA,blade,Blade Abundance – Alaria (ind/cm²),Ostrea Blade Ab - Ala,2,2022-07-30_2
468,Pabay_30_7_22_2,2,Pabay,Saccharina,30/07/2022,30,7,2022,30/07/2022,pecten_ala_p_cm,NA,blade,Blade Abundance – Alaria (ind/cm²),Pecten Blade Ab - Ala,2,2022-07-30_2
469,Pabay_30_7_22_2,2,Pabay,Saccharina,30/07/2022,30,7,2022,30/07/2022,scallop_brown_ala_p_cm,NA,blade,Blade Abundance – Alaria (ind/cm²),Scallop Blade Ab - Ala,2,2022-07-30_2
470,Pabay_30_7_22_2,2,Pabay,Saccharina,30/07/2022,30,7,2022,30/07/2022,bivalve_ala_p_cm,NA,blade,Blade Abundance – Alaria (ind/cm²),Bivalvia Blade Ab - Ala,2,2022-07-30_2
471,Pabay_30_7_22_3,3,Pabay,Alaria,30/07/2022,30,7,2022,30/07/2022,mytilus_ala_p_cm,NA,blade,Blade Abundance – Alaria (ind/cm²),Mytilus Blade Ab - Ala,3,2022-07-30_3
472,Pabay_30_7_22_3,3,Pabay,Alaria,30/07/2022,30,7,2022,30/07/2022,ostrea_ala_p_cm,NA,blade,Blade Abundance – Alaria (ind/cm²),Ostrea Blade Ab - Ala,3,2022-07-30_3
473,Pabay_30_7_22_3,3,Pabay,Alaria,30/07/2022,30,7,2022,30/07/2022,pecten_ala_p_cm,NA,blade,Blade Abundance – Alaria (ind/cm²),Pecten Blade Ab - Ala,3,2022-07-30_3
474,Pabay_30_7_22_3,3,Pabay,Alaria,30/07/2022,30,7,2022,30/07/2022,scallop_brown_ala_p_cm,NA,blade,Blade Abundance – Alaria (ind/cm²),Scallop Blade Ab - Ala,3,2022-07-30_3
475,Pabay_30_7_22_3,3,Pabay,Alaria,30/07/2022,30,7,2022,30/07/2022,bivalve_ala_p_cm,NA,blade,Blade Abundance – Alaria (ind/cm²),Bivalvia Blade Ab - Ala,3,2022-07-30_3
476,Pabay_30_7_22_3,3,Pabay,Saccharina,30/07/2022,30,7,2022,30/07/2022,mytilus_ala_p_cm,NA,blade,Blade Abundance – Alaria (ind/cm²),Mytilus Blade Ab - Ala,3,2022-07-30_3
477,Pabay_30_7_22_3,3,Pabay,Saccharina,30/07/2022,30,7,2022,30/07/2022,ostrea_ala_p_cm,NA,blade,Blade Abundance – Alaria (ind/cm²),Ostrea Blade Ab - Ala,3,2022-07-30_3
478,Pabay_30_7_22_3,3,Pabay,Saccharina,30/07/2022,30,7,2022,30/07/2022,pecten_ala_p_cm,NA,blade,Blade Abundance – Alaria (ind/cm²),Pecten Blade Ab - Ala,3,2022-07-30_3
479,Pabay_30_7_22_3,3,Pabay,Saccharina,30/07/2022,30,7,2022,30/07/2022,scallop_brown_ala_p_cm,NA,blade,Blade Abundance – Alaria (ind/cm²),Scallop Blade Ab - Ala,3,2022-07-30_3
480,Pabay_30_7_22_3,3,Pabay,Saccharina,30/07/2022,30,7,2022,30/07/2022,bivalve_ala_p_cm,NA,blade,Blade Abundance – Alaria (ind/cm²),Bivalvia Blade Ab - Ala,3,2022-07-30_3
486,Pabay_7_5_22_1,1,Pabay,Saccharina,07/05/2022,7,5,2022,07/05/2022,mytilus_ala_p_cm,NA,blade,Blade Abundance – Alaria (ind/cm²),Mytilus Blade Ab - Ala,1,2022-05-07_1
487,Pabay_7_5_22_1,1,Pabay,Saccharina,07/05/2022,7,5,2022,07/05/2022,ostrea_ala_p_cm,NA,blade,Blade Abundance – Alaria (ind/cm²),Ostrea Blade Ab - Ala,1,2022-05-07_1
488,Pabay_7_5_22_1,1,Pabay,Saccharina,07/05/2022,7,5,2022,07/05/2022,pecten_ala_p_cm,NA,blade,Blade Abundance – Alaria (ind/cm²),Pecten Blade Ab - Ala,1,2022-05-07_1
489,Pabay_7_5_22_1,1,Pabay,Saccharina,07/05/2022,7,5,2022,07/05/2022,scallop_brown_ala_p_cm,NA,blade,Blade Abundance – Alaria (ind/cm²),Scallop Blade Ab - Ala,1,2022-05-07_1
490,Pabay_7_5_22_1,1,Pabay,Saccharina,07/05/2022,7,5,2022,07/05/2022,bivalve_ala_p_cm,NA,blade,Blade Abundance – Alaria (ind/cm²),Bivalvia Blade Ab - Ala,1,2022-05-07_1
496,Pabay_7_5_22_2,2,Pabay,Saccharina,07/05/2022,7,5,2022,07/05/2022,mytilus_ala_p_cm,NA,blade,Blade Abundance – Alaria (ind/cm²),Mytilus Blade Ab - Ala,2,2022-05-07_2
497,Pabay_7_5_22_2,2,Pabay,Saccharina,07/05/2022,7,5,2022,07/05/2022,ostrea_ala_p_cm,NA,blade,Blade Abundance – Alaria (ind/cm²),Ostrea Blade Ab - Ala,2,2022-05-07_2
498,Pabay_7_5_22_2,2,Pabay,Saccharina,07/05/2022,7,5,2022,07/05/2022,pecten_ala_p_cm,NA,blade,Blade Abundance – Alaria (ind/cm²),Pecten Blade Ab - Ala,2,2022-05-07_2
499,Pabay_7_5_22_2,2,Pabay,Saccharina,07/05/2022,7,5,2022,07/05/2022,scallop_brown_ala_p_cm,NA,blade,Blade Abundance – Alaria (ind/cm²),Scallop Blade Ab - Ala,2,2022-05-07_2
500,Pabay_7_5_22_2,2,Pabay,Saccharina,07/05/2022,7,5,2022,07/05/2022,bivalve_ala_p_cm,NA,blade,Blade Abundance – Alaria (ind/cm²),Bivalvia Blade Ab - Ala,2,2022-05-07_2
506,Pabay_7_5_22_3,3,Pabay,Saccharina,07/05/2022,7,5,2022,07/05/2022,mytilus_ala_p_cm,NA,blade,Blade Abundance – Alaria (ind/cm²),Mytilus Blade Ab - Ala,3,2022-05-07_3
507,Pabay_7_5_22_3,3,Pabay,Saccharina,07/05/2022,7,5,2022,07/05/2022,ostrea_ala_p_cm,NA,blade,Blade Abundance – Alaria (ind/cm²),Ostrea Blade Ab - Ala,3,2022-05-07_3
508,Pabay_7_5_22_3,3,Pabay,Saccharina,07/05/2022,7,5,2022,07/05/2022,pecten_ala_p_cm,NA,blade,Blade Abundance – Alaria (ind/cm²),Pecten Blade Ab - Ala,3,2022-05-07_3
509,Pabay_7_5_22_3,3,Pabay,Saccharina,07/05/2022,7,5,2022,07/05/2022,scallop_brown_ala_p_cm,NA,blade,Blade Abundance – Alaria (ind/cm²),Scallop Blade Ab - Ala,3,2022-05-07_3
510,Pabay_7_5_22_3,3,Pabay,Saccharina,07/05/2022,7,5,2022,07/05/2022,bivalve_ala_p_cm,NA,blade,Blade Abundance – Alaria (ind/cm²),Bivalvia Blade Ab - Ala,3,2022-05-07_3
511,Pabay_8_2_22_1,1,Pabay,Saccharina,08/02/2022,8,2,2022,08/02/2022,mytilus_ala_p_cm,NA,blade,Blade Abundance – Alaria (ind/cm²),Mytilus Blade Ab - Ala,1,2022-02-08_1
512,Pabay_8_2_22_1,1,Pabay,Saccharina,08/02/2022,8,2,2022,08/02/2022,ostrea_ala_p_cm,NA,blade,Blade Abundance – Alaria (ind/cm²),Ostrea Blade Ab - Ala,1,2022-02-08_1
513,Pabay_8_2_22_1,1,Pabay,Saccharina,08/02/2022,8,2,2022,08/02/2022,pecten_ala_p_cm,NA,blade,Blade Abundance – Alaria (ind/cm²),Pecten Blade Ab - Ala,1,2022-02-08_1
514,Pabay_8_2_22_1,1,Pabay,Saccharina,08/02/2022,8,2,2022,08/02/2022,scallop_brown_ala_p_cm,NA,blade,Blade Abundance – Alaria (ind/cm²),Scallop Blade Ab - Ala,1,2022-02-08_1
515,Pabay_8_2_22_1,1,Pabay,Saccharina,08/02/2022,8,2,2022,08/02/2022,bivalve_ala_p_cm,NA,blade,Blade Abundance – Alaria (ind/cm²),Bivalvia Blade Ab - Ala,1,2022-02-08_1
516,Pabay_8_2_22_1,1,Pabay,Alaria,08/02/2022,8,2,2022,08/02/2022,mytilus_ala_p_cm,NA,blade,Blade Abundance – Alaria (ind/cm²),Mytilus Blade Ab - Ala,1,2022-02-08_1
517,Pabay_8_2_22_1,1,Pabay,Alaria,08/02/2022,8,2,2022,08/02/2022,ostrea_ala_p_cm,NA,blade,Blade Abundance – Alaria (ind/cm²),Ostrea Blade Ab - Ala,1,2022-02-08_1
518,Pabay_8_2_22_1,1,Pabay,Alaria,08/02/2022,8,2,2022,08/02/2022,pecten_ala_p_cm,NA,blade,Blade Abundance – Alaria (ind/cm²),Pecten Blade Ab - Ala,1,2022-02-08_1
519,Pabay_8_2_22_1,1,Pabay,Alaria,08/02/2022,8,2,2022,08/02/2022,scallop_brown_ala_p_cm,NA,blade,Blade Abundance – Alaria (ind/cm²),Scallop Blade Ab - Ala,1,2022-02-08_1
520,Pabay_8_2_22_1,1,Pabay,Alaria,08/02/2022,8,2,2022,08/02/2022,bivalve_ala_p_cm,NA,blade,Blade Abundance – Alaria (ind/cm²),Bivalvia Blade Ab - Ala,1,2022-02-08_1
521,Pabay_8_2_22_2,2,Pabay,Saccharina,08/02/2022,8,2,2022,08/02/2022,mytilus_ala_p_cm,NA,blade,Blade Abundance – Alaria (ind/cm²),Mytilus Blade Ab - Ala,2,2022-02-08_2
522,Pabay_8_2_22_2,2,Pabay,Saccharina,08/02/2022,8,2,2022,08/02/2022,ostrea_ala_p_cm,NA,blade,Blade Abundance – Alaria (ind/cm²),Ostrea Blade Ab - Ala,2,2022-02-08_2
523,Pabay_8_2_22_2,2,Pabay,Saccharina,08/02/2022,8,2,2022,08/02/2022,pecten_ala_p_cm,NA,blade,Blade Abundance – Alaria (ind/cm²),Pecten Blade Ab - Ala,2,2022-02-08_2
524,Pabay_8_2_22_2,2,Pabay,Saccharina,08/02/2022,8,2,2022,08/02/2022,scallop_brown_ala_p_cm,NA,blade,Blade Abundance – Alaria (ind/cm²),Scallop Blade Ab - Ala,2,2022-02-08_2
525,Pabay_8_2_22_2,2,Pabay,Saccharina,08/02/2022,8,2,2022,08/02/2022,bivalve_ala_p_cm,NA,blade,Blade Abundance – Alaria (ind/cm²),Bivalvia Blade Ab - Ala,2,2022-02-08_2
526,Pabay_8_2_22_2,2,Pabay,Alaria,08/02/2022,8,2,2022,08/02/2022,mytilus_ala_p_cm,NA,blade,Blade Abundance – Alaria (ind/cm²),Mytilus Blade Ab - Ala,2,2022-02-08_2
527,Pabay_8_2_22_2,2,Pabay,Alaria,08/02/2022,8,2,2022,08/02/2022,ostrea_ala_p_cm,NA,blade,Blade Abundance – Alaria (ind/cm²),Ostrea Blade Ab - Ala,2,2022-02-08_2
528,Pabay_8_2_22_2,2,Pabay,Alaria,08/02/2022,8,2,2022,08/02/2022,pecten_ala_p_cm,NA,blade,Blade Abundance – Alaria (ind/cm²),Pecten Blade Ab - Ala,2,2022-02-08_2
529,Pabay_8_2_22_2,2,Pabay,Alaria,08/02/2022,8,2,2022,08/02/2022,scallop_brown_ala_p_cm,NA,blade,Blade Abundance – Alaria (ind/cm²),Scallop Blade Ab - Ala,2,2022-02-08_2
530,Pabay_8_2_22_2,2,Pabay,Alaria,08/02/2022,8,2,2022,08/02/2022,bivalve_ala_p_cm,NA,blade,Blade Abundance – Alaria (ind/cm²),Bivalvia Blade Ab - Ala,2,2022-02-08_2
531,Pabay_8_2_22_3,3,Pabay,Saccharina,08/02/2022,8,2,2022,08/02/2022,mytilus_ala_p_cm,NA,blade,Blade Abundance – Alaria (ind/cm²),Mytilus Blade Ab - Ala,3,2022-02-08_3
532,Pabay_8_2_22_3,3,Pabay,Saccharina,08/02/2022,8,2,2022,08/02/2022,ostrea_ala_p_cm,NA,blade,Blade Abundance – Alaria (ind/cm²),Ostrea Blade Ab - Ala,3,2022-02-08_3
533,Pabay_8_2_22_3,3,Pabay,Saccharina,08/02/2022,8,2,2022,08/02/2022,pecten_ala_p_cm,NA,blade,Blade Abundance – Alaria (ind/cm²),Pecten Blade Ab - Ala,3,2022-02-08_3
534,Pabay_8_2_22_3,3,Pabay,Saccharina,08/02/2022,8,2,2022,08/02/2022,scallop_brown_ala_p_cm,NA,blade,Blade Abundance – Alaria (ind/cm²),Scallop Blade Ab - Ala,3,2022-02-08_3
535,Pabay_8_2_22_3,3,Pabay,Saccharina,08/02/2022,8,2,2022,08/02/2022,bivalve_ala_p_cm,NA,blade,Blade Abundance – Alaria (ind/cm²),Bivalvia Blade Ab - Ala,3,2022-02-08_3
536,Pabay_8_2_22_3,3,Pabay,Alaria,08/02/2022,8,2,2022,08/02/2022,mytilus_ala_p_cm,NA,blade,Blade Abundance – Alaria (ind/cm²),Mytilus Blade Ab - Ala,3,2022-02-08_3
537,Pabay_8_2_22_3,3,Pabay,Alaria,08/02/2022,8,2,2022,08/02/2022,ostrea_ala_p_cm,NA,blade,Blade Abundance – Alaria (ind/cm²),Ostrea Blade Ab - Ala,3,2022-02-08_3
538,Pabay_8_2_22_3,3,Pabay,Alaria,08/02/2022,8,2,2022,08/02/2022,pecten_ala_p_cm,NA,blade,Blade Abundance – Alaria (ind/cm²),Pecten Blade Ab - Ala,3,2022-02-08_3
539,Pabay_8_2_22_3,3,Pabay,Alaria,08/02/2022,8,2,2022,08/02/2022,scallop_brown_ala_p_cm,NA,blade,Blade Abundance – Alaria (ind/cm²),Scallop Blade Ab - Ala,3,2022-02-08_3
540,Pabay_8_2_22_3,3,Pabay,Alaria,08/02/2022,8,2,2022,08/02/2022,bivalve_ala_p_cm,NA,blade,Blade Abundance – Alaria (ind/cm²),Bivalvia Blade Ab - Ala,3,2022-02-08_3
546,Pabay_8_3_22_1,1,Pabay,Alaria,08/03/2022,8,3,2022,08/03/2022,mytilus_ala_p_cm,NA,blade,Blade Abundance – Alaria (ind/cm²),Mytilus Blade Ab - Ala,1,2022-03-08_1
547,Pabay_8_3_22_1,1,Pabay,Alaria,08/03/2022,8,3,2022,08/03/2022,ostrea_ala_p_cm,NA,blade,Blade Abundance – Alaria (ind/cm²),Ostrea Blade Ab - Ala,1,2022-03-08_1
548,Pabay_8_3_22_1,1,Pabay,Alaria,08/03/2022,8,3,2022,08/03/2022,pecten_ala_p_cm,NA,blade,Blade Abundance – Alaria (ind/cm²),Pecten Blade Ab - Ala,1,2022-03-08_1
549,Pabay_8_3_22_1,1,Pabay,Alaria,08/03/2022,8,3,2022,08/03/2022,scallop_brown_ala_p_cm,NA,blade,Blade Abundance – Alaria (ind/cm²),Scallop Blade Ab - Ala,1,2022-03-08_1
550,Pabay_8_3_22_1,1,Pabay,Alaria,08/03/2022,8,3,2022,08/03/2022,bivalve_ala_p_cm,NA,blade,Blade Abundance – Alaria (ind/cm²),Bivalvia Blade Ab - Ala,1,2022-03-08_1
556,Pabay_8_3_22_2,2,Pabay,Alaria,08/03/2022,8,3,2022,08/03/2022,mytilus_ala_p_cm,NA,blade,Blade Abundance – Alaria (ind/cm²),Mytilus Blade Ab - Ala,2,2022-03-08_2
557,Pabay_8_3_22_2,2,Pabay,Alaria,08/03/2022,8,3,2022,08/03/2022,ostrea_ala_p_cm,NA,blade,Blade Abundance – Alaria (ind/cm²),Ostrea Blade Ab - Ala,2,2022-03-08_2
558,Pabay_8_3_22_2,2,Pabay,Alaria,08/03/2022,8,3,2022,08/03/2022,pecten_ala_p_cm,NA,blade,Blade Abundance – Alaria (ind/cm²),Pecten Blade Ab - Ala,2,2022-03-08_2
559,Pabay_8_3_22_2,2,Pabay,Alaria,08/03/2022,8,3,2022,08/03/2022,scallop_brown_ala_p_cm,NA,blade,Blade Abundance – Alaria (ind/cm²),Scallop Blade Ab - Ala,2,2022-03-08_2
560,Pabay_8_3_22_2,2,Pabay,Alaria,08/03/2022,8,3,2022,08/03/2022,bivalve_ala_p_cm,NA,blade,Blade Abundance – Alaria (ind/cm²),Bivalvia Blade Ab - Ala,2,2022-03-08_2
566,Pabay_8_3_22_3,3,Pabay,Alaria,08/03/2022,8,3,2022,08/03/2022,mytilus_ala_p_cm,NA,blade,Blade Abundance – Alaria (ind/cm²),Mytilus Blade Ab - Ala,3,2022-03-08_3
567,Pabay_8_3_22_3,3,Pabay,Alaria,08/03/2022,8,3,2022,08/03/2022,ostrea_ala_p_cm,NA,blade,Blade Abundance – Alaria (ind/cm²),Ostrea Blade Ab - Ala,3,2022-03-08_3
568,Pabay_8_3_22_3,3,Pabay,Alaria,08/03/2022,8,3,2022,08/03/2022,pecten_ala_p_cm,NA,blade,Blade Abundance – Alaria (ind/cm²),Pecten Blade Ab - Ala,3,2022-03-08_3
569,Pabay_8_3_22_3,3,Pabay,Alaria,08/03/2022,8,3,2022,08/03/2022,scallop_brown_ala_p_cm,NA,blade,Blade Abundance – Alaria (ind/cm²),Scallop Blade Ab - Ala,3,2022-03-08_3
570,Pabay_8_3_22_3,3,Pabay,Alaria,08/03/2022,8,3,2022,08/03/2022,bivalve_ala_p_cm,NA,blade,Blade Abundance – Alaria (ind/cm²),Bivalvia Blade Ab - Ala,3,2022-03-08_3
